Code,Name,Address,Postcode
A81001,The Densham Surgery,"The Health Centre, Lawson Street, Stockton-On-Tees, Cleveland",TS18 1HU
A81002,Queens Park Medical Centre,"Queens Park Medical Ctr, Farrer Street, Stockton On Tees, Cleveland",TS18 2AW
A81004,Bluebell Medical Centre,"Trimdon Avenue, Middlesbrough, Cleveland",TS5 8SB
A81005,Springwood Surgery,"Rectory Lane, Guisborough",TS14 7DJ
A81006,Tennant Street Medical Practice,"Tennant St Medical Pract, Farrer Street, Stockton On Tees, Cleveland",TS18 2AT
A81007,Bankhouse Surgery,"One Life Hartlepool, Park Road, Hartlepool, Cleveland",TS24 7PW
A81009,Village Medical Centre,"The Village Medical Ctr, 400/404 Linthorpe Road, Middlesbrough, Cleveland",TS5 6HF
A81011,Chadwick Practice,"One Life Hartlepool, Park Road, Hartlepool, Cleveland",TS24 7PW
A81012,Westbourne Medical Centre,"7 Trinity Mews, N. Ormesby, Middlesbrough",TS3 6AL
A81013,Brotton Surgery,"Alford Road, Brotton, Saltburn By Sea",TS12 2FF
A81014,Queenstree Practice,"The Health Centre, Queensway, Billingham, Cleveland",TS23 2LA
A81016,Park Surgery,"One Life, Linthorpe Road, Middlesbrough, Cleveland",TS1 3QY
A81017,Woodbridge Practice,"The Health Centre, Trenchard Ave, Thornaby, Stockton On Tees, Cleveland",TS17 0EE
A81018,Bentley Medical Practice,"Redcar Primary Care Hosp, West Dyke Road, Redcar, Cleveland",TS10 4NW
A81019,Crossfell Health Centre,"Crossfell Road, Berwick Hills, Middlesbrough, Cleveland",TS3 7RL
A81020,Martonside Medical Centre,"1A Martonside Way, Middlesbrough, Cleveland",TS4 3BU
A81021,Normanby Medical Centre,"Low Grange Hv, Normanby Rd, Middlesbrough, Cleveland",TS6 6TD
A81022,Hillside Practice,"Windermere Drive, Skelton, Saltburn By The Sea, Cleveland",TS12 2TG
A81023,The Endeavour Practice,"The Health Centre, 20 Cleveland Square, Middlesbrough, Cleveland",TS1 2NX
A81025,The Dovecot Surgery,"The Health Centre, Lawson Street, Stockton On Tees, Cleveland",TS18 1HU
A81026,The Linthorpe Surgery,"378 Linthorpe Road, Middlesbrough, Cleveland",TS5 6HA
A81027,Yarm Medical Practice,"Mulberry House, 1 Worsall Road, Yarm, Cleveland",TS15 9DD
A81029,Prospect Surgery,"The Health Centre, Po Box 101E, 20 Cleveland Square, Middlesbrough",TS1 2NX
A81030,Borough Road & Nunthorpe Medical Group,"167A Borough Road, Middlesbrough",TS1 3RY
A81031,Havelock Grange Practice,"One Life Hartlepool, Park Road, Hartlepool, Cleveland",TS24 7PW
A81032,The Garth,"The Garth Surgery, Rectory Lane, Guisborough, Cleveland",TS14 7DJ
A81034,Thornaby & Barwick Medical Group,"Thornaby Health Centre, Trenchard Ave, Thornaby, Stockton On Tees, Cleveland",TS17 0EE
A81035,Newlands Medical Centre,"Borough Road, Middlesbrough, Cleveland",TS1 3RX
A81036,Norton Medical Centre,"Billingham Road, Norton, Stockton-On-Tees, Cleveland",TS20 2UZ
A81037,The Erimus Practice,"The Cleveland Health Ctr, 20 Cleveland Square, Middlesbrough",TS1 2NX
A81038,Hirsel Medical Centre,"5 Trinity Mews, N.Ormesby, Middlesbrough, Cleveland",TS3 6AL
A81039,Eaglescliffe Medical Practice,"Eaglescliffe Med Practice, Sunningdale Drive, Eaglescliffe, Stockton-On-Tees",TS16 9EA
A81040,Marsh House Medical Practice,"Abbey Health Centre, Finchale Avenue, Billingham, Cleveland",TS23 2DG
A81041,Hart Medical Practice,"Surgery Lane, Hartlepool, Cleveland",TS24 9DN
A81042,South Grange Medical Group Practice,"South Grange Medical Ctr., Trunk Road, Eston, Middlesbrough, Cleveland",TS6 9QG
A81043,The Manor House Surgery,"Braidwood Road, Normanby, Middlesbrough, Cleveland",TS6 0HA
A81044,Mckenzie House Surgery,"Mckenzie House, 17 Kendal Road, Hartlepool, Cleveland",TS25 1QU
A81045,The Coatham Road Surgery,"The Coatham Surgery, Coatham Health Village, Redcar, Cleveland",TS10 1SR
A81046,Woodlands Family Medical Centre,"Woodlands Family Med. Ctr, 106 Yarm Lane, Stockton-On-Tees, Cleveland",TS18 1YE
A81048,Zetland Medical Practice,"Windy Hill Lane, Marske By The Sea, Redcar, Cleveland",TS11 7BL
A81049,Kings Medical Centre,"3 Trinity Mews, N.Ormesby, Middlesbrough",TS3 6AL
A81051,Cambridge Medical Group,"The Cambridge Med. Group, 10A Cambridge Road, Linthorpe, Middlesbrough, Cleveland",TS5 5NN
A81052,The Green House Surgery,"Redcar Primary Care Hosp, West Dyke Road, Redcar, Cleveland",TS10 4NW
A81053,Woodside Surgery,"6 High Street, Loftus, Saltburn-By-The-Sea, Cleveland",TS13 4HW
A81054,The Saltscar Surgery,"22 Kirkleatham Street, Redcar, Cleveland",TS10 1UA
A81056,Melrose Surgery,"38 Melrose Avenue, Billingham, Cleveland",TS23 2JW
A81057,Kingsway Medical Centre,"Kingsway, Billingham, Cleveland",TS23 2LS
A81058,Coulby Medical Practice,"Cropton Way, Coulby Newham, Middlesbrough",TS8 0TL
A81060,The Koh Practice,"The Health Centre, Victoria Road, Hartlepool, Cleveland",TS26 8DB
A81063,The Headland Medical Centre,"The Headland Medical Ctr, 2 Grove Street, Hartlepool",TS24 0NZ
A81064,The Discovery Practice,"Cleveland Health Centre, 20 Cleveland Square, Cleveland Centre, Middlesbrough",TS1 2NX
A81065,The Eston Surgery,"Low Grange Health Village, Normanby Road, Eston, Cleveland",TS6 6TD
A81066,Park Lane Surgery,"Stillington, Stockton On Tees, Cleveland",TS21 1JS
A81067,Alma Medical Centre,"Nolan Place, Stockton-On-Tees",TS18 2BP
A81070,Mckenzie Group Practice,"Wynyard Road PCC, Wynyard Road, Hartlepool",TS25 3DQ
A81602,Dr Rasool,"Abbey Health Centre, Finchale Avenue, Billingham, Cleveland",TS23 2DG
A81608,Elm Tree Surgery,"22B Westbury Street, Thornaby, Stockton-On-Tees, Cleveland",TS17 6PG
A81610,The Roseberry Practice,"Abbey Health Centre, Finchale Avenue, Billingham, Cleveland",TS23 2DG
A81611,Parkway Medical Centre,"Cropton Way, Coulby Newham, Middlesbrough",TS8 0TL
A81612,The Patel Practice,"The Surgery, Station Lane, Seaton Carew, Hartlepool, Cleveland",TS25 1AX
A81618,Huntcliff Surgery,"Bath Street, Saltburn-By-The-Sea",TS12 1BJ
A81621,Thorntree Surgery,"11 Beresford Buildings, Middlesbrough, Cleveland",TS3 9NB
A81622,Gladstone House Surgery,"Victoria Road, 46 Victoria Road, Hartlepool, Cleveland",TS26 8DF
A81629,Riverside Medical Practice,"Riverside Medical Pract., Alma Street, Stockton-On-Tees, Cleveland",TS18 2AP
A81630,Foundations,"Acklam Road, Acklam, Middlesbrough",TS5 4EQ
A81631,West View Millenium Surgery A,"West View Millennium Surg, West View Road, Hartlepool, Cleveland",TS24 9LJ
A81633,Foundations -Harris Street,"Foundations, 7 Harris Street, Middlesbrough",TS1 5EF
A81634,The Arrival Practice,"Endurance Hse, Clarence St, Stockton On Tees",TS18 2EP
A82003,Ulverston Health Centre (Murray),"Ulverston Comm.Health Ctr, Stanley Street, Ulverston, Cumbria",LA12 7BT
A82004,Alston Medical Practice,"The Surgery, Cottage Hospital, Alston, Cumbria",CA9 3QX
A82005,Ambleside Health Centre,"Rydal Road, Ambleside, Cumbria",LA22 9BP
A82006,Appleby Medical Practice,"The Riverside Building, Chapel Street, Appleby, Cumbria",CA16 6QR
A82007,Duke Street Surgery,"4 Duke Street, Barrow In Furness, Cumbria",LA14 1LF
A82008,Norwood Medical Centre,"99 Abbey Road, Barrow-In-Furness, Cumbria",LA14 5ES
A82009,Bridgegate Medical Centre,"Winchester Street, Barrow-In-Furness, Cumbria",LA13 9SH
A82010,Abbey Road Surgery,"243 Abbey Road, Barrow-In-Furness, Cumbria",LA14 5JY
A82012,Brampton Medical Practice,"4 Market Place, Brampton, Carlisle, Cumbria",CA8 1NL
A82013,Upper Eden Medical Practice,"The Health Centre, Silver Street, Kirkby Stephen, Cumbria",CA17 4RB
A82014,Caldbeck Surgery,"Friar Row, Caldbeck, Wigton, Cumbria",CA7 8DS
A82015,Warwick Road Surgery,"65 Warwick Road, Carlisle, Cumbria",CA1 1EB
A82016,Carlisle Healthcare,"Spencer House, St.Paul's Square, Carlisle, Cumbria",CA1 1DG
A82018,Spencer St Surgery,"Spencer Street Surgery, 10 Spencer Street, Carlisle, Cumbria",CA1 1BP
A82019,Fusehill Medical Practice,"Fusehill Medical Centre, Fusehill Street, Carlisle, Cumbria",CA1 2HE
A82020,Eden Medical Group,"The Eden Medical Group, Port Road, Carlisle, Cumbria",CA2 7AJ
A82021,Castlegate and Derwent Surgery,"Cockermouth Health Centre, Isel Road, Cockermouth, Cumbria",CA13 9HT
A82022,Dalston Medical Group,"The Surgery, Townhead Road, Dalston, Carlisle, Cumbria",CA5 7PZ
A82023,Distington Surgery,"The Surgery, Hinnings Road, Distington, Workington, Cumbria",CA14 5UR
A82024,Seascale Health Centre,"Gosforth Road, Seascale, Cumbria",CA20 1PN
A82025,Captain French Surgery,"The Gillinggate Centre, Gillinggate, Kendal, Cumbria",LA9 4JE
A82026,The James Cochrane Pract.,"James Cochrane Practice, Burton Road, Kendal, Cumbria",LA9 7HR
A82027,Station House Surgery,"Station Road, Kendal, Cumbria",LA9 6SA
A82028,Castlehead Medical Centre,"Ambleside Road, Keswick, Cumbria",CA12 4DB
A82029,The Croft Surgery,"Kirkbride, Carlisle, Cumbria",CA7 5JH
A82030,Lunesdale Surgery,"The Lunesdale Surgery, Kirkby Lonsdale, Nr Carnforth, Lancashire",LA6 2HQ
A82031,Shap Medical Practice,"Shap Health Centre, Peggy Nut Croft, Shap, Penrith, Cumbria",CA10 3LW
A82032,Maryport Health Services,"Alneburgh Hse, Ewanrigg Rd, Maryport, Cumbria",CA15 8EL
A82033,Waterloo House Surgery,"Millom Community Hospital, Lapstone Road, Millom, Cumbria",LA18 4BY
A82034,Stoneleigh Surgery,"Police Square, Milnthorpe, Cumbria",LA7 7PW
A82035,Birbeck Medical Group,"Penrith Health Centre, Bridge Lane, Penrith, Cumbria",CA11 8HW
A82036,The Lakes Medical Practice,"Penrith Health Centre, Bridge Lane, Penrith, Cumbria",CA11 8HW
A82037,Silloth Group Medical Practice,"Lawn Terrace, Silloth On Solway, Wigton, Cumbria",CA7 4AH
A82038,Temple Sowerby Medical Practice,"Linden Park, Temple Sowerby, Penrith, Cumbria",CA10 1RW
A82039,Dalton Surgery,"The Surgery, 92 Market Street, Dalton-In-Furness, Cumbria",LA15 8AB
A82041,Lowther Medical Centre,"1 Castle Meadows, Whitehaven, Cumbria",CA28 7RG
A82044,Fellview Healthcare Ltd,"Beech House Med. Ctr., St.Bridget's Lane, Egremont, Cumbria",CA28 7QE
A82045,Wigton Group Medical Practice,"Wigton Group Medical Prac, South End, Wigton, Cumbria",CA7 9QD
A82046,Windermere Health Centre,"Goodley Dale, Windermere, Cumbria",LA23 2EG
A82047,James Street Group Pract,"James Street, Workington, Cumbria",CA14 2DL
A82048,Beechwood Group Practice,"57 John Street, Workington, Cumbria",CA14 3FT
A82049,Orchard House Surgery,"South William Street, Workington, Cumbria",CA14 2ED
A82050,Oxford Street Surgery,"20 Oxford Street, Workington, Cumbria",CA14 2AJ
A82053,Nutwood Medical Practice,"The Health Centre, Kents Bank Road, Grange Over Sands, Cumbria",LA11 7DJ
A82055,Aspatria Medical Group,"West Street Health Centre, West Street, Aspatria, Cumbria",CA7 3HH
A82058,Queen Street Medical Practice,"Richard Benedict House, 149 Queen Street, Whitehaven",CA28 7BA
A82062,Atkinson Health Centre,"Market Street, Barrow In Furness, Cumbria",LA14 2LR
A82064,Westcroft House Surgery,"66 Main Street, Egremont, Cumbria",CA22 2DB
A82065,Peninsula Medical Practice,"Grange Health Centre, Station Road, Flookburgh, Grange-Over-Sands, Cumbria",LA11 7DJ
A82068,Ulverston Community Health Centre,"Ulverston Comm.Health Ctr, Stanley Street, Ulverston, Cumbria",LA12 7BT
A82070,St.Mary's Surgery,"Applethwaite, Windermere, Cumbria",LA23 1BA
A82071,Burnett Edgar Medical Ctr,"Central Drive, Walney, Barrow-In-Furness, Cumbria",LA14 3HY
A82072,Risedale Surgery,"2-4 Gloucester Street, Barrow-In-Furness, Cumbria",LA13 9RX
A82074,Arnside Surgery,"The Surgery, Orchard Road, Arnside, Carnforth, Cumbria",LA5 0DP
A82075,Mansion House Surgery,"19/20 Irish Street, Whitehaven, Cumbria",CA28 7BU
A82077,Liverpool House Surgery,"69 Risedale Road, Barrow-In-Furness, Cumbria",LA13 9QY
A82608,Sedbergh Medical Practice,"Sedbergh M/Ctr, Station Rd, Sedbergh, Cumbria",LA10 5DL
A82613,Wraysdale House Surgery,"Wraysdale House, Coniston, Cumbria",LA21 8ER
A82617,Kirkoswald Surgery,"The Surgery, Kirkoswald, Penrith, Cumbria",CA10 1DQ
A82620,Glenridding Health Centre,"Glenridding, Penrith, Cumbria",CA11 0PD
A82621,Askam Surgery,"The Surgery, 2 Parklands Drive, Askam-In-Furness, Cumbria",LA16 7JP
A82623,Solway Health Services,"Workington Hpl, Park Lane, Workington",CA14 2RW
A82629,The Family Practice,"The Surgery, 26 Hartington Street, Barrow-In-Furness, Cumbria",LA14 5SL
A82631,Court Thorn Surgery,"Low Hesket, Carlisle, Cumbria",CA4 0HP
A82646,Longtown Medical Centre,"Moor Road, Longtown",CA6 5XA
A82647,Cartmel Surgery,"Haggs Lane, Cartmel",LA11 6PH
A82650,Haverthwaite Surgery,"Haverthwaite, Backbarrow, Ulverston, Cumbria",LA12 8QF
A82651,Duddon Valley Medical Practice,"Kirkby Surgery, Askew Gate, Kirkby-In-Furness, Cumbria",LA17 7TE
A82654,Warwick Square Group Practice,"Grosvenor House Surgery, Warwick Square, Carlisle, Cumbria",CA1 1LB
A83001,St andrew's Medical Practice,"Sensier House, St andrew's Lane, Spennymoor, County Durham",DL16 6QA
A83003,Willington Medical Group,"Chapel Street, Willington, Crook, County Durham",DL15 0EQ
A83004,Avenue Family Practice,"Deneside Medical Centre, The Avenue, Deneside, Seaham, County Durham",SR7 8LF
A83005,Whinfield Medical Practice,"Whinfield Surgery, Whinbush Way, Darlington, County Durham",DL1 3RT
A83006,Orchard Court Surgery,"Orchard Road, Darlington, County Durham",DL3 6HZ
A83007,Blackhall and Peterlee Practice,"Blackhall & Peterlee, Community Health Centre, Hesleden Road, Blackhall, Hartlepool, Cleveland",TS27 4LQ
A83008,Hallgarth Surgery,"Cheapside, Shildon, County Durham",DL4 2HP
A83009,Bridge End Surgery,"Pick Tree Lane, Chester-Le-Street, County Durham",DH3 3SL
A83010,Moorlands Surgery,"139A Willow Road, Darlington, County Durham",DL3 9JP
A83011,Claypath & University Medical Group,"Claypath & Univ Med Group, 26 Gilesgate, Durham, County Durham",DH1 1QW
A83012,William Brown Centre,"Manor Way, Peterlee, County Durham",SR8 5TW
A83013,Neasham Road Surgery,"186 Neasham Road, Darlington, County Durham",DL1 4YL
A83014,Belmont & Sherburn Medical Group,"Broomside Lane, Belmont, County Durham",DH1 2QW
A83015,Station View Medical Centre,"Station View Medical Ctr, 29A Escomb Road, Bishop Auckland, County Durham",DL14 6AB
A83016,Tanfield View Medical Group,"Tanfield View Surgery, Scott St, Tanfield, Stanley, County Durham",DH9 8AD
A83017,Phoenix Medical Group,"Dunelm Road, Thornley, Durham, County Durham",DH6 3HW
A83018,Consett Medical Centre,"Station Yard, Consett, County Durham",DH8 5YA
A83020,North House Surgery,"Hope Street, Crook, County Durham",DL15 9HU
A83021,Auckland Medical Group,"The Old Fire House, Watling Road, Bishop Auckland, County Durham",DL14 6RP
A83022,The Medical Group,"Adrian Clark House, Sawmills Lne, Meadowfield, Durham, County Durham",DH7 8NH
A83023,Stanley Medical Group,"Stanley Primary Care Ctr, Clifford Road, Stanley, County Durham",DH9 0AB
A83024,West Rainton Surgery,"The Surgery, Woodland View, West Rainton, Houghton-Le-Spring, County Durham",DH4 6RQ
A83025,Bishopgate Medical Centre,"178 Newgate Street, Bishop Auckland, County Durham",DL14 7EJ
A83026,Sacriston Medical Centre,"Front Street, Sacriston, County Durham",DH7 6JW
A83027,Coxhoe Medical Practice,"1 Lansdowne Road, Coxhoe, County Durham",DH6 4DH
A83028,Middle Chare Medical Group,"Middle Chare Surgery, Middle Chare, Chester-Le-Street, County Durham",DH3 3QD
A83029,Great Lumley Surgery,"The Surgery, Front Street, Great Lumley, Chester-Le-Street, Co.Durham",DH3 4LE
A83030,Dunelm Medical Practice,"Kelvin House Medical Ctr., 1-2 Victor Tce, Bearpark, Durham, County Durham",DH7 7DG
A83031,Carmel Medical Practice,"Nunnery Lane, Darlington, County Durham",DL3 8SQ
A83032,Woodview Medical Practice,"The Surgery, Cockfield, Bishop Auckland, Co.Durham",DL13 5AF
A83033,Pelton & Fellrose Medical Group,"Unit 1, Lavender Centre, Pelton Lane, Pelton, Chester Le Street, County Durham",DH2 1HS
A83034,Blacketts Medical Practice,"Blacketts Med Practice, 63-65 Bondgate, Darlington, County Durham",DL3 7JR
A83035,The Weardale Practice,"Dale Street, Stanhope, Bishop Auckland, County Durham",DL13 2XD
A83036,Chastleton Medical Group,"Newton Drive, Framwellgate Moor, County Durham",DH1 5BH
A83037,Bewick Crescent Surgery,"27 Bewick Crescent, Newton Aycliffe, County Durham",DL5 5LH
A83038,Cedars Medical Group,"Cedar Cres, Burnopfield, Newcastle Upon Tyne",NE16 6HU
A83040,Clifton Court Medical Practice,"Clifton Court Med Pract, Victoria Road, Darlington, County Durham",DL1 5JN
A83041,Murton Medical Centre,"The Surgery, 20 Woods Tce East, Murton, Seaham, County Durham",SR7 9AB
A83043,Old Forge Surgery,"The Surgery, Middleton-In-Teesdale, Barnard Castle, County Durham",DL12 0QE
A83044,The Horden Group Practice,"Sea View Health Centre, Sunderland Rd, Horden, Peterlee, County Durham",SR8 4LD
A83045,Ferryhill and Chilton Medical Practice,"The Surgery, Durham Road, Ferryhill, County Durham",DL17 8JJ
A83046,Barnard Castle Surgery,"Victoria Road, Barnard Castle, County Durham",DL12 8HT
A83047,Denmark Street Surgery,"Denmark Street, Darlington, County Durham",DL3 0PD
A83048,Rockliffe Court Surgery,"The Surgery, Rockliffe Court, Hurworth Place, Darlington, Co.Durham",DL2 2DS
A83049,Queens Road Surgery,"83 Queens Road, Blackhill, Consett, County Durham",DH8 0BW
A83050,Cestria Health Centre,"Whitehill Way, Chester-Le-Street, County Durham",DH2 3DJ
A83051,Marlborough Surgery,"Seaham Primary Care Ctr, St John's Square, Seaham, County Durham",SR7 7JE
A83052,Bishops Close Medical Practice,"Spennymoor Health Centre, Bishop's Close, Spennymoor, County Durham",DL16 6ED
A83054,Skerne Medical Group,"Harbinson House, Front Street, Sedgefield, Stockton-On-Tees, Cleveland",TS21 3BN
A83055,Cheveley Park Medical Ctr,"The Links, Belmont, Durham, County Durham",DH1 2UW
A83057,East Durham Medical Group,"The Carodoc Surgery, Front Street West, Wingate, County Durham",TS28 5PZ
A83060,Pinfold Medical Practice,"Pinfold Lane, Butterknowle, Bishop Auckland, County Durham",DL13 5NX
A83061,Gainford Surgery,"Main Road, Gainford, Darlington, County Durham",DL2 3BE
A83066,Jubilee Medical Group,"Jubilee M/G, Cobblers Hall, Carers Way, Burn Lane, Newton Aycliffe, County Durham",DL5 4SE
A83070,St George's Medical Practice,"St George's M/P, Yarm Rd, Middleton Lane, Middleton St.George, Darlington, Co.Durham",DL2 1BY
A83071,The New Seaham Medical Group,"Eastdene Road, Eastlea, Seaham, County Durham",SR7 8DY
A83072,Lanchester Medical Centre,"Durham Road, Lanchester, County Durham",DH7 0LP
A83073,Drs Lambert & Ng,"9 West Road, Annfield Plain, Stanley, County Durham",DH9 7XT
A83074,Pease Way Medical Centre,"The Pease Way Medical Ctr, 2 Pease Way, Newton Aycliffe, County Durham",DL5 5NH
A83075,Deneside Medical Centre,"The Avenue, Deneside, Seaham, County Durham",SR7 8LF
A83603,Oxford Road Medical Practice,"The Surgery, Oxford Road, Spennymoor, County Durham",DL16 6BQ
A83610,Wingate Medical Practice Intrahealth,"The Medical Centre, Front Street West, Wingate, County Durham",TS28 5PZ
A83616,Bevan Medical Group,"Bevan Grove, Shotton Colliery, County Durham",DH6 2LQ
A83617,Browney House Surgery,"Front St, Langley Park, Durham, County Durham",DH7 9YT
A83618,Oakfields Health Group,"Oakfields Health Centre, Hamsterley Colliery, Newcastle Upon Tyne",NE17 7SB
A83619,Southdene Medical Centre,"Front St, Shotton Colliery, Co.Durham",DH6 2LT
A83622,The Haven Surgery,"The Surgery, The Haven, Burnhope, Durham",DH7 0BD
A83626,Evenwood Medical Practice,"Copeland Lane, Evenwood, Bishop Auckland, County Durham",DL14 9SU
A83627,Silverdale Family Practice,"Silverdale Family Pract, Sth Hetton HC, Front St, South Hetton, County Durham",DH6 2TH
A83630,Denholm House,"Brandon Lane Surgery, Stack Garth, Brandon, Durham",DH7 8SJ
A83632,Craghead Medical Centre,"The Middles, Craghead, Stanley, County Durham",DH9 6AN
A83634,West Cornforth Medical Centre,"West Cornforth Med Ctr, Reading Street, West Cornforth, Ferryhill, Durham",DL17 9LH
A83635,Bowburn Medical Centre,"Bow Street, Bowburn, Durham",DH6 5AL
A83636,Leadgate Surgery,"George Ewen House, Watling St.,Leadgate, Consett, Co.Durham",DH8 6DP
A83637,Gardiner Crescent,"21 Gardiner Crescent, Pelton Fell, Chester-Le-Street, Co.Durham",DH2 2NJ
A83641,Parkgate Surgery,"Parkgate Health Centre, Park Place, Darlington, County Durham",DL1 5LW
A83644,Annfield Plain Surgery,"Durham Road, Annfield Plain, Stanley, Co.Durham",DH9 7TD
A84002,The Rothbury Practice,"3 Market Place, Rothbury, Morpeth, Northumberland",NE65 7UW
A84003,Lintonville Medical Group,"Lintonville Terrace, Ashington, Northumberland",NE63 9UT
A84005,Bedlingtonshire Med.Group,"Glebe Road, Bedlington, Northumberland",NE22 6JX
A84006,Alnwick Medical Group,"Lower Building, Infirmary Close, Alnwick, Northumberland",NE66 2NL
A84007,Ponteland Medical Group,"Ponteland Prim. Care Ctr., Meadowfield, Ponteland, Newcastle Upon Tyne",NE20 9SD
A84008,Belford Medical Practice,"Croft Field, Belford, Northumberland",NE70 7ER
A84009,Railway Medical Group,"Gatacre Street, The Hlth Ctr, Thoroton St, Blyth, Northumberland",NE24 1HD
A84011,White Medical Group,"Ponteland Prim. Care Ctr., Meadowfield, Ponteland, Newcastle Upon Tyne",NE20 9SD
A84013,The Gables Medical Group,"26 St Johns Road, Bedlington, Northumberland",NE22 7DU
A84014,Marine Medical Group,"The Hlth Ctr, Thoroton St, Blyth, Northumberland",NE24 1DX
A84015,Laburnum Surgery,"Laburnum Medical Group, 14 Laburnum Terrace, Ashington, Northumberland",NE63 0XX
A84016,Prudhoe Medical Group,"Kepwell Bank Top, Prudhoe, Northumberland",NE42 5PW
A84018,Corbridge Health Centre,"Newcastle Road, Corbridge, Northumberland",NE45 5LG
A84020,Guidepost Medical Group,"North Parade, Guidepost, Choppington, Northumberland",NE62 5RA
A84022,Coquet Medical Group,"Amble Hlth Ctr, Amble, Morpeth, Northumberland",NE65 0HD
A84024,Burn Brae Medical Group,"Hexham Primary Care Ctr, Corbridge Road, Hexham, Northumberland",NE46 1QJ
A84025,Cramlington Medical Group,"The Health Ctr, Forum Way, Cramlington, Northumberland",NE23 6QN
A84026,Well Close Medical Group,"Well Close Square Surgery, Well Close Square, Berwick Upon Tweed, Northumberland",TD15 1LL
A84027,Bellingham Practice,"Bellingham, Hexham, Northumberland",NE48 2HE
A84028,Seaton Park Medical Group,"Seaton Hirst Prim Cre Ctr, Norham Road, Ashington, Northumberland",NE63 0NG
A84029,Widdrington Surgery,"Grange Road, Widdrington, Morpeth, Northumberland",NE61 5LX
A84030,Village Medical Group,"The Village Surgery, Dudley Lane, Cramlington, Northumberland",NE23 6US
A84031,Greystoke Surgery,"Morpeth Nhs Centre, The Mount, Morpeth, Northumberland",NE61 1JX
A84032,Cheviot Medical Group,"Padgepool Place, Wooler, Northumberland",NE71 6BL
A84033,The Sele Medical Practice,"Hexham Primary Care Ctr, Corbridge Road, Hexham, Northumberland",NE46 1QJ
A84034,Haltwhistle Medical Group,"The Health Centre, Greencroft Avenue, Haltwhistle, Northumberland",NE49 9AP
A84035,Riversdale Surgery,"51 Woodcroft Road, Wylam, Northumberland",NE41 8DH
A84036,Wellway Medical Group,"The Surgery, Wellway, Morpeth, Northumberland",NE61 1BJ
A84037,Netherfield House,"Station Road, Seghill, Cramlington, Northumberland",NE23 7EF
A84038,Forum Family Practice,"The Health Centre, Forum Way, Cramlington, Northumberland",NE23 6QN
A84039,Gas House Lane Surgery,"Morpeth Nhs Centre, The Mount, Morpeth, Northumberland",NE61 1JX
A84040,Humshaugh & Wark Med Grp,"The Surgery, Humshaugh, Hexham, Northumberland",NE46 4BU
A84042,Scots Gap Medical Group,"The Surgery, Scots Gap, Morpeth, Northumberland",NE61 4EG
A84043,Brockwell Medical Group,"Brockwell Centre, Northumbrian Road, Cramlington, Northumberland",NE23 1XZ
A84044,Union Brae & Norham Prac,"Union Brae, Tweedmouth, Berwick-Upon-Tweed, Northumberland",TD15 2HB
A84045,Haydon Bridge & Allendale Medical Pract,"Haydon Brg&Allendale M/P, North Bank, Haydon Bridge, Hexham, Northumberland",NE47 6LA
A84047,Branch End Surgery,"Main Road, Stocksfield, Northumberland",NE43 7LL
A84604,The Glendale Surgery,"Glendale Surg, Cheviot PCC, Padgepool Place, Wooler, Northumberland",NE71 6BL
A84609,Felton Surgery,"Middle Farm, 51 Main St., Felton, Morpeth, Northumberland",NE65 9PR
A84614,The Adderlane Surgery,"Adderlane Road, West Wylam, Prudhoe, Northumberland",NE42 5HR
A84619,Elsdon Avenue Surgery,"Elsdon Ave, Seaton Delaval, Whitley Bay, Tyne and Wear",NE25 0BW
A85001,Fell Tower Medical Centre,"575 Durham Rd, Low Fell, Gateshead, Tyne & Wear",NE9 5EY
A85002,Bensham Family Practice,"Sidney Grove, Bensham, Gateshead, Tyne & Wear",NE8 2XB
A85003,Rowlands Gill Medical Centre,"The Medical Centre, The Grove, Rowlands Gill, Tyne & Wear",NE39 1PW
A85004,Longrigg Medical Centre,"2 Longrigg, Leam Lane Est., Felling, Gateshead, Tyne & Wear",NE10 8PH
A85005,Oxford Tce & Rawling Rd Medical Group,"Oxford Tce&Rawling Rd Mg, 1 Oxford Terrace, Bensham, Gateshead, Tyne & Wear",NE8 1RQ
A85006,Glenpark Medical Centre,"61 Ravensworth Rd, Dunston, Gateshead, Tyne & Wear",NE11 9AD
A85007,Fell Cottage Surgery,"123 Kells Lane, Low Fell, Gateshead, Tyne & Wear",NE9 5XY
A85008,Birtley Medical Group,"Durham Road, Birtley, County Durham",DH3 2QT
A85009,Crowhall Medical Centre,"Felling Health Centre, Stephenson Tce, Felling, Gateshead, Tyne & Wear",NE10 9QG
A85010,Chainbridge Medical Partnership,"Chainbridge Medical Pship, Shibdon Road, Blaydon, Tyne & Wear",NE21 5AE
A85011,St. Albans Medical Group,"St.Albans Medical Group, Felling Health Centre, Stephenson Tce, Felling, Gateshead, Tyne & Wear",NE10 9QG
A85012,Metro Interchange Surgery,"New Century House, Jackson Street, Gateshead, Tyne & Wear",NE8 1HR
A85013,Millennium Family Practice,"Millenium Family Practice, Trinity Square Health Ctr, Gateshead, Tyne & Wear",NE8 1AD
A85014,Crawcrook Medical Centre,"Pattinson Drive, Crawcrook, Ryton, Tyne & Wear",NE40 4US
A85016,Wrekenton Medical Group,"Springwell Road, Wrekenton, Gateshead, Tyne & Wear",NE9 7AD
A85017,Bewick Road Surgery,"10 Bewick Road, Gateshead, Tyne & Wear",NE8 4DP
A85018,Oldwell Surgery,"10 Front Street, Winlaton, Tyne and Wear",NE21 4RD
A85019,Central Gateshead Medical Group,"Central Gateshead Med Grp, The Health Centre, Prince Consort Road, Gateshead, Tyne & Wear",NE8 1NB
A85020,Whickham Cottage Medical Centre,"Whickham Cottage Med Prac, Rectory Lane, Whickham, Newcastle Upon Tyne, Tyne & Wear",NE16 4PD
A85021,Second Street Surgery,"Second Street, Bensham, Gateshead, Tyne & Wear",NE8 2UR
