Code,Name,Address,Postcode
M83061,Millrise Medical Practice,"12 Millrise Road, Milton, Stoke On Trent, Staffordshire",ST2 7BW
M83062,Laurel House Surgery,"12 Albert Road, Tamworth, Staffordshire",B79 7JN
M83063,Norton Canes Health Centre,"Norton Canes Health Ctr., Brownhills Road, Norton Canes, Cannock, Staffordshire",WS11 9SE
M83065,Barton,"Barton Family Practice, Short Lane, Barton Under Needwood, Staffordshire",DE13 8LT
M83066,Hartshill Medical Centre,"Ashwell Road, Hartshill, Stoke On Trent, Staffordshire",ST4 6AT
M83067,Lyme Valley Medical Centre,"Lyme Valley Road, Newcastle-Under-Lyme, Staffordshire",ST5 3TF
M83068,Belgrave Medical Centre,"116 Belgrave Road, Dresden, Stoke On Trent, Staffordshire",ST3 4LR
M83069,Mansion House Surgery,"Abbey Street, Stone",ST15 8YE
M83070,Gnosall,"Gnosall Surgery/Hlth Ctr, Gnosall Health Centre, Brookhouse Road, Gnosall, Stafford",ST20 0GP
M83071,Park Medical Centre,"Ball Haye Road, Leek, Staffordshire",ST13 6QR
M83072,Salters Meadow Health Ctr,"Rugeley Road, Chase Terrace, Burntwood, Staffordshire",WS7 1AQ
M83073,Stapenhill Medical Centre,"Fyfield Road, Stapenhill, Burton-On-Trent, Staffordshire",DE15 9QD
M83074,Balance Street,"Balance Street Practice, Balance Street Health Ctr, Balance Street, Uttoxeter, Staffordshire",ST14 8JG
M83075,Norfolk Street Surgery,"Norfolk Street, Shelton, Stoke On Trent, Staffordshire",ST1 4PB
M83076,Harley Street Medical Ctr,"Harley Street, Hanley, Stoke On Trent, Staffordshire",ST1 3RX
M83079,Dr J Greig & Partners,"Moorland Medical Centre, Dyson House, Regent Street, Leek, Staffordshire",ST13 6LU
M83082,The Haymarket Health Ctr,"Dunning St, Tunstall, Stoke On Trent, Staffordshire",ST6 5BE
M83084,Dr Robinson & Partners,"Kidsgrove Medical Centre, Mount Road, Kidsgrove, Stoke-On-Trent, Staffordshire",ST7 4AY
M83088,Hollies Practice,"Tamworth Health Centre, Upper Gungate, Tamworth",B79 7EA
M83089,Biddulph Doctors,"Biddulph Primary Care Ctr, Wharf Road, Biddulph, Stoke On Trent, Staffordshire",ST8 6AG
M83090,Dunrobin Street Medical Centre,"Medical Centre, Dunrobin Street, Longton, Stoke-On-Trent",ST3 4LL
M83092,Crown Surgery,"The Crown Surgery, 23 High Street, Eccleshall, Stafford, Staffordshire",ST21 6BW
M83093,Dale Medical Practice,"Dale Medical Practice, Planks Lane, Wombourne, Wolverhampton",WV5 8DX
M83094,Brook Medical Centre,"98 Chell Heath Road, Bradeley, Stoke-On-Trent",ST6 7NN
M83096,Dr Ks Upton's Practice,"The Tardis Surgery, 5-9 Queen St, Cheadle, Stoke-On-Trent, Staffordshire",ST10 1BH
M83097,Bilbrook Medical Centre,"Bilbrook Medical Centre, Brookfield Road, Bilbrook, Wolverhampton, West Midlands",WV8 1DX
M83100,Dr P D Miles and Dr R Valasapalli,"Meir Primary Care Centre, Weston Road, Meir, Stoke On Trent, Staffordshire",ST3 6AB
M83102,Potteries Medical Centre,"Beverley Drive, Bentilee, Stoke On Trent, Staffordshire",ST2 0JG
M83103,Dr P Craven's Practice,"Allen Street Surgery, Allen Street, Cheadle, Stoke-On-Trent",ST10 1HJ
M83107,Alderwood Medical Practice,"Alderwood Medical Prac, Longford Road, Cannock, Staffordshire",WS11 1QN
M83108,Dr Do Yates' Practice,"Well Street Medical Ctr, Well Street, Cheadle, Stoke On Trent, Staffordshire",ST10 1EY
M83109,Dr Manickam & Partner,"Hednesford Valley H/Ctr, Station Road, Hednesford, Cannock, Staffordshire",WS12 4DJ
M83110,Heathview Medical Practice,"Glascote Heath Health Ctr, Caledonian, Tamworth",B77 2ED
M83111,Riverside Surgery,"41-42 Balfour, Riverside, Tamworth",B79 7BH
M83113,Dr Khare's Surgery,"Stonydelph Medical Ctr, Ellerbeck, Stonydelph, Staffordshire",B77 4JA
M83115,Boney Hay Surgery,"11 Longfellow Road, Boney Hay, Walsall, West Midlands",WS7 2EY
M83117,Crown Medical Practice,"Tamworth Health Centre, Upper Gungate, Tamworth, Staffordshire",B79 7EA
M83121,Tean Surgery,"Old Road, Tean, Stoke-On-Trent, Staffordshire",ST10 4EG
M83122,Waterhouses Medical Pract,"Waterhouses Medical Ctre, Waterfall Lane, Waterhouses, Stoke-On-Trent",ST10 3HY
M83123,Birches Head Medical Ctr.,"Diana Road, Birches Head, Stoke On Trent, Staffordshire",ST1 6RS
M83125,Claverley,"The Surgery, Spicers Close, Claverley, Wolverhampton",WV5 7BY
M83126,Longton Hall Surgery,"186 Longton Hall Road, Blurton, Stoke-On-Trent",ST3 2EJ
M83127,Cobridge Surgery,"Cobridge Community HC, Church Terrace, Cobridge, Stoke On Trent, Staffordshire",ST6 2JN
M83128,Merton Surgery,"Merton Street, Longton, Stoke-On-Trent",ST3 1LG
M83129,Heath Hayes Health Centre,"Gorsemoor Rd, Heath Hayes, Cannock, Staffordshire",WS12 3TG
M83130,Red Lion Surgery,"Cannock Chase Hospital, Brunswick Road, Cannock, Staffordshire",WS11 5XY
M83132,Lakeside,"Lakeside Medical Centre, Church Road, Perton, Wolverhampton",WV6 7PD
M83134,The Surgery Foden Street,"The Surgery, 32 Foden Street, Stoke-On-Trent",ST4 4BX
M83138,Drs Shah & Talpur,"Hanford Health Centre, New Inn Lane, Hanford, Stoke-On-Trent",ST4 8EX
M83139,Moss Street Surgery,"Chadsmoor, Cannock, Staffordshire",WS11 6DE
M83140,Higherland Surgery,"3 Orme Road, Poolfield, Newcastle-Under-Lyme",ST5 2UE
M83141,Kingsbridge Medical Centre,"Kingsbridge House, Kingsbridge Ave, Clayton, Newcastle-Under-Lyme, Staffordshire",ST5 3HP
M83143,Goldenhill Medical Centre,"High Street, Goldenhill, Stoke On Trent",ST6 5QJ
M83146,The Moorcroft Medical Ctr,"Botteslow St, Hanley, Stoke On Trent, Staffordshire",ST1 3NJ
M83148,The Peel Medical Practice,"Peel Court, 2 Aldergate, Tamworth, Staffordshire",B79 7DJ
M83601,Brinsley Avenue Practice,"11 Brinsley Avenue, Trentham, Stoke-On-Trent, Stafordshire",ST4 8LT
M83608,Quinton Practice,"Health Centre, Wardles Lane, Great Wyrley, West Midlands",WS6 6EW
M83616,Dr I Rasib & Partners,"GPSuite, Cannock Chase Hospital, Brunswick Road, Cannock, Staffordshire",WS11 5XY
M83617,Darwin Medical Centre,"St.Chad's Health Centre, St Chads HC, Dimbles Lane, Lichfield, Staffordshire",WS13 7HT
M83619,Drs Rees & Lefroy,"Stoke Health Centre, Honeywall, Stoke-On-Trent",ST4 7JB
M83623,Snowhill Medical Centre,"Shelton Primary Care Ctr, Norfolk Street, Shelton, Stoke On Trent, Staffordshire",ST1 4PB
M83624,Cambridge House,"124 Werrington Road, Bucknall, Stoke-On-Trent",ST2 9AJ
M83625,Dr Vsr Chadalavada,"Woodhead Road, Abbey Hulton, Stoke On Trent, Staffordshire",ST2 8DH
M83627,Apsley Surgery,"Cobridge Health Centre, Church Terrace, Cobridge, Stoke On Trent, Staffordshire",ST6 2JN
M83632,Trinity Medical Centre,"Uttoxeter Road, Blythe Bridge, Staffordshire",ST11 9HQ
M83637,Chadsmoor Medical Practice,"Chadsmoor Medical Pract., 45 Princess Street, Chadsmoor, Cannock, Staffordshire",WS11 5JT
M83638,The Colliery Practice,"Hednesford Street Surgery, 60 Hednesford Street, Cannock",WS11 1DJ
M83640,Alton Surgery,"Hurston's Lane, Alton, Stoke-On-Trent, Staffordshire",ST10 4AP
M83641,Mill View Surgery,"Mill Street, Rocester, Uttoxeter, Staffordshire",ST14 5JX
M83650,Tunstall Primary Care Centre,"Tunstall PCC, Alexandra Pk, Scotia Road, Tunstall, Stoke On Trent, Staffordshire",ST6 6BE
M83661,Adderley Green Surgery,"Longton Health Centre, Adderley Green, Longton, Stoke On Trent, Staffordshire",ST3 1EQ
M83665,R J Mitchell Medical Centre,"19 Wright Street, Butt Lane, Kidsgrove, Stoke On Trent",ST7 1NY
M83668,Tamar Medical Centre,"Severn Drive, Perton, Wolverhampton",WV6 7QL
M83670,Keele Practice,"Health Centre, Keele University, Keele, Newcastle, Staffordshire",ST5 5BG
M83680,Northgate Surgery,"Carters Square, Uttoxeter, Staffordshire",ST14 7FN
M83681,All Saints Surgery,"28 All Saints Road, Burton-On-Trent, Staffordshire",DE14 3LS
M83682,Lucie Wedgwood Health Ctr,"Chapel Lane, Burslem, Stoke-On-Trent, Staffordshire",ST6 2AB
M83691,Betley Surgery,"The Surgery, Main Road, Wrinehill",CW3 9BJ
M83693,Tri-Links Medical Practice,"Tri-Links, Amington Surg, 130 Tamworth Rd, Amington, Tamworth, Staffordshire",B77 3BZ
M83697,Milehouse Medical Practice,"Milehouse PCC, Lymebrook Way, Milehouse, Newcastle-Under-Lyme, Staffordshire",ST5 9GA
M83698,Southfield Way Surgery,"The Medical Centre, 2A Southfield Way, Great Wyrley, Walsall",WS6 6JZ
M83700,Five Towns GP Surgery,"Shelton Primary Care Ctr, Norfolk Street, Shelton, Stoke On Trent, Staffordshire",ST1 4PB
M83701,Talke Pits Clinic,"High Street, Talke Pits, Stoke-On-Trent, Staffordshire",ST7 1QQ
M83703,Brereton Surgery,"88 Main Road, Brereton, Rugeley, Staffordshire",WS15 1DU
M83705,Trinity Surgery,"Stonydelph Health Centre, Ellerbeck, Stonydelph, Tamworth, Staffordshire",B77 4JA
M83706,Dr Vije's Surgery,"Stonydelph Health Centre, Ellerbeck, Stonydelph, Tamworth, Staffordshire",B77 4JA
M83709,Baddeley Green Surgery,"988 Leek New Road, Baddeley Green",ST9 9PB
M83711,Trentham Mews Medical Centre,"Trentham Mews Medical Ctr, Eastwick Cresc, Trentham, Stoke-On-Trent",ST4 8XP
M83712,Practice Of Dr Ak Sinha,"16 Rosslyn Road, Longton, Stoke-On-Trent",ST3 4JD
M83713,Dr H P Borse & Partner,"Meir Primary Care Centre, Weston Road, Meir, Stoke On Trent, Staffordshire",ST3 6AB
M83714,Practice Of Dr Sb Kulkarni,"Stoke Health Centre, Honeywall, Stoke-On-Trent",ST4 7JB
M83715,Featherstone,"Featherstone Family H.C., Old Lane (Off Hilton Rd), Featherstone, Wolverhampton",WV10 7BS
M83717,Norton Canes Surgery,"Norton Canes Health Ctr, Brownhills Road, Norton Canes, Cannock",WS11 9SE
M83718,Peel Croft,"Peel Croft Surgery, Lichfield Street, Burton-On-Trent",DE14 3RH
M83719,Rawnsley Surgery,"The Surgery, Rawnsley Road, Rawnsley, Cannock, Staffordshire",WS12 1JF
M83722,Dr M Murugan,"Hednesford Valley H/Ctr, Station Road, Hednesford, Staffordshire",WS12 4DH
M83723,Loomer Road Surgery,"Loomer Road, Chesterton, Newcastle Under Lyme, Staffordshire",ST5 7JS
M83725,Blurton Medical Centre,"Blurton Health Centre, Ripon Rd, Blurton, Stoke-On-Trent",ST3 3BS
M83727,Norton Canes Practice,"Norton Canes Health Ctr, Brownhills Road, Norton Canes, Cannock",WS11 9SE
M83738,Aelfgar Surgery,"Church Street, Rugeley, Staffordshire",WS15 2AB
M84001,Red Roofs Surgery,"31 Coton Road, Nuneaton, Warwickshire",CV11 5TW
M84002,Pool Medical Centre,"The Pool Medical Centre, Pool Road, Studley, Warwickshire",B80 7QU
M84003,Arbury Medical Centre,"Cambridge Drive, Stockingford, Nuneaton",CV10 8LW
M84004,Whitehall Medical Practice,"Whitehall Medical Pract., Morton Gardens, Lower Hillmorton Road, Rugby, Warwickshire",CV21 3AQ
M84005,Chapel End Surgery,"10 Camp Hill Road, Nuneaton, Warwickshire",CV10 0JH
M84006,Pear Tree Surgery,"28 Meadow Close, Kingsbury, Nr.Tamworth, Staffordshire",B78 2NR
M84007,Dordon & Polesworth Group Practice,"The Surgery, 162 Long Street, Dordon, Tamworth, Staffordshire",B78 1QA
M84008,Spring Hill Medical Centre,"Phil Collins Way, Arley, Coventry",CV7 8FD
M84009,Fenny Compton Surgery,"High Street, Fenny Compton, Southam, Warwickshire",CV47 2YG
M84010,Avonside Health Centre,"Portobello Way, Warwick",CV34 5GJ
M84011,Bedworth Health Centre,"The Health Centre, High Street, Bedworth, Warwickshire",CV12 8NQ
M84012,Park Leys Medical Practice,"Park Leys Med Practice, Keresley Green Med Centre, Coventry, West Midlands",CV6 2FL
M84013,Castle Medical Centre,"22 Bertie Road, Kenilworth, Warwickshire",CV8 1JP
M84014,Bridge House Medical Centre,"Bridge House Medical Ctr., Scholars Lane, Stratford-Upon-Avon, Warwickshire",CV37 6HE
M84015,Croft Medical Centre,"Calder Walk, Leamington Spa, Warwickshire",CV31 1SA
M84016,Wolston Surgery,"School Street, Wolston, Coventry, West Midlands",CV8 3HG
M84017,Clarendon Lodge Medical Centre,"Clarendon Lodge, 16 Clarendon Street, Leamington Spa, Warwickshire",CV32 5SS
M84018,Bidford Health Centre,"Stratford Road, Bidford On Avon, Warwickshire",B50 4LX
M84019,The Atherstone Surgery,"The Surgery, 1 Ratcliffe Road, Atherstone, Warwickshire",CV9 1EU
M84020,Clifton Road Surgery,"26 Clifton Road, Rugby, Warwickshire",CV21 3QF
M84021,Rother House Medical Centre,"Rother House Medical Ctr., Alcester Road, Stratford-Upon-Avon, Warwickshire",CV37 6PP
M84022,Manor Court Surgery,"5 Manor Court Avenue, Nuneaton, Warwickshire",CV11 5HX
M84023,Central Surgery,"Corporation Street, Rugby, Warwickshire",CV21 3SP
M84024,Henley-In-Arden Med Ctr,"Prince Harry Road, Henley-In-Arden, Solihull",B95 5GD
M84025,Shipston Medical Centre,"The Medical Centre, Badgers Cres, Stratford Rd, Shipston-On-Stour, Warwickshire",CV36 4BQ
M84026,Southam Surgery,"The Surgery, Stowe Drive, Southam, Leamington Spa, Warwickshire",CV47 1NY
M84028,Priory Medical Centre,"Cape Road, Warwick",CV34 4UN
M84029,Cubbington Rd Surgery,"115 Cubbington Road, Lillington, Leamington Spa, Warwickshire",CV32 7AT
M84030,Hastings House Surgery,"Hastings House Med Ctr, Rivers Way, Wellesbourne, Warwick",CV35 9RH
M84031,Revel Surgery,"The Surgery, Barr Lane, Brinklow, Rugby, Warwickshire",CV23 0LU
M84032,Waterside Medical Centre,"Court Street, Leamington Spa, Warwickshire",CV31 2BB
M84034,Whitestone Surgery,"82 Bulkington Lane, Nuneaton, Warwickshire",CV11 4SB
M84035,Westside Medical Centre,"Westside M/C, Hilton House, Corporation Street, Rugby",CV21 2DN
M84036,Abbey Medical Centre,"42 Station Road, Kenilworth, Warwickshire",CV8 1JD
M84037,The Grange Medical Centre,"39 Leicester Road, Nuneaton, Warwickshire",CV11 6AB
M84040,Sherbourne Medical Centre,"40 Oxford Street, Leamington Spa, Warwickshire",CV32 4RA
M84041,Riversley Road Surgery,"The Surgery, Riversley Road, Nuneaton, Warwickshire",CV11 5QT
M84042,Hazelwood Group Practice,"27 Parkfield Road, Coleshill, Birmingham",B46 3LD
M84043,Trinity Court Surgery,"Stratford Healthcare, Arden Street, Stratford Upon Avon",CV37 6HJ
M84044,Harbury Surgery,"Mill Street, Harbury, Leamington Spa, Warwickshire",CV33 9HR
M84046,Dunchurch Surgery,"Dunsmore Heath, Dunchurch, Rugby",CV22 6AP
M84047,Tanworth-In-Arden Med Ctr,"Medical Centre, The Birches, Broad Lane, Tanworth-In-Arden, Solihull, West Midlands",B94 5DY
M84049,Alcester Health Centre,"Fields Park Drive, Alcester, Warwickshire",B49 6QR
M84050,Market Quarter Medical Practice,"Mkt Quarter Med Practice, Health & Wellbeing Centre, Rugby, Warwickshire",CV21 3HX
M84051,Old Mill Surgery,"Marlborough Road, Nuneaton, Warwickshire",CV11 5PQ
M84055,Stockingford Medical Centre,"13 Northumberland Avenue, Stockingford, Nuneaton, Warwickshire",CV10 8EJ
M84059,Spa Medical Centre,"81 Radford Road, Leamington Spa, Warwickshire",CV31 1NE
M84060,The Arrow Surgery,"Fields Park Drive, Alcester, Warwickshire",B49 6QR
M84061,Bulkington Surgery,"School Rd, Bulkington, Bedworth, Warwickshire",CV12 9JB
M84062,Vale Of Red Horse,"Kineton Surgery, The Old School, Market Square, Kineton, Warwickshire",CV35 0LP
M84063,Chase Meadow Health Centre,"2 Alder Meadow, Chase Meadow Square, Warwick",CV34 6JY
M84064,Whitnash Medical Centre,"110 Coppice Rd, Whitnash, Leamington Spa, Warwickshire",CV31 2LT
M84065,Beech Tree Medical Practice,"Beech Tree Med Practice, Health & Wellbeing Centre, Rugby, Warwickshire",CV21 3HX
M84066,Meon Medical Centre,"Goose Lane, Lower Quinton, Stratford-Upon-Avon, Warwickshire",CV37 8TA
M84067,Bennfield Surgery,"Hilton Hse, Corporation St, Rugby, Warwickshire",CV21 2DN
M84069,Budbrooke Medical Centre,"Slade Hill, Hampton Magna, Budbrooke, Warwickshire",CV35 8SA
M84070,Warwick Gates Fam.Hth.Ctr,"Cressida Close, Heathcote, Warwick",CV34 6DZ
M84609,Woodlands Surgery,"301 Newtown Road, Bedworth, Nuneaton, Warwickshire",CV12 0AJ
M84612,Station Street Surgery,"45 Station Street, Atherstone, Warwickshire",CV9 1DB
M84615,Chancery Lane Surgery,"Chapel End, Nuneaton, Warwickshire",CV10 0PB
M84616,Brookside Surgery,"Stretton On Dunsmore, Nr Rugby, Warwickshire",CV23 9NH
M84617,Arden Medical Centre,"Albany Road, Stratford-On-Avon, Warwickshire",CV37 6PG
M84618,Rugby Road Surgery,"18 Rugby Road, Bulkington, Nuneaton",CV12 9JE
M84620,Lapworth Surgery,"Old Warwick Road, Lapworth, Solihull",B94 6LH
M84621,Queens Road Surgery,"88A Queens Road, Nuneaton, Warwickshire",CV11 5LE
M84627,The Old Cole House Practice,"The Old Cole House, 41 Park Road, Bedworth, Nuneaton, Warwickshire",CV12 8LH
M84629,St Wulfstan Surgery,"Northfield Road, Kineton Road Estate, Southam",CV47 0FG
M85001,Castle Vale Primary Care Centre,"Shah Zaman Surgery, Cvpcc, 70 Tangmere Drive, Birmingham, West Midlands",B35 7QX
M85002,Handsworth Wood Med.Ctr.,"110-114 Church Lane, Handsworth Wood, Birmingham",B20 2ES
M85005,The Park Medical Centre,"Park Medical Centre, 691 Coventry Road, Birmingham",B10 0JL
M85006,Green Ridge Surgery,"671 Yardley Wood Road, Billesley, Birmingham",B13 0HN
M85007,West Heath Surgery,"196 West Heath Road, Birmingham",B31 3HB
M85008,The Poolway Medical Centre,"Fao Church Lane Hlth Ctr, Kents Moat Est, Sheldon, Birmingham",B33 9EN
M85009,Hamstead Road Surgery,"168 Hamstead Road, Handsworth, Birmingham",B20 2QR
M85011,The Swan Medical Centre,"Swan Medical Centre, 4 Willard Road, South Yardley",B25 8AA
M85013,Church Lane - Khan,"113 Church Lane, Stechford, Birmingham",B33 9EJ
M85014,Kingsbury Road Medical Centre,"273 Kingsbury Road, Erdington, Birmingham",B24 8RD
M85016,Hillcrest Surgery,"Hillcrest Surgery, 9 Twickenham Road, Kingstanding, Birmingham",B44 0NN
M85018,Yardley Wood Health Centre,"Yardley Wood Health Ctr., 401 Highfield Road, Yardley Wood, Birmingham",B14 4DU
M85019,Tower Hill Partnership,"433 Walsall Rd Perry Barr, Birmingham, West Midlands",B42 1BT
M85020,Raydocs Newtown,"Newtown Health Centre, 171 Melbourne Ave, Newtown, Birmingham, West Midlands",B19 2JA
M85021,Moseley Medical Centre,"21 Salisbury Rd, Moseley, Birmingham",B13 8JS
M85023,Millennium Medical Centre,"121 Weoley Castle Road, Weoley Castle, Birmingham",B29 5QD
M85024,The Limes Medical Centre,"Cooksey Road, Small Heath, Birmingham",B10 0BS
M85025,Bath Row Medical Practice,"First Floor, Colston Suite, Attwood Grn HC,30 Bath Rw, Birmingham",B15 1LZ
M85026,Dr Ap Blight's Practice,"Ashfield Surgery, 8 Walmley Road, Sutton Coldfield, West Midlands",B76 1QN
M85027,Leach Heath Medical Centre,"Leach Heath Medical Ctr., Leach Heath Lane, Rubery, Birmingham",B45 9BU
M85028,Lordswood House Group Medical Practice,"54 Lordswood Road, Harborne, Birmingham",B17 9DB
M85029,Granton Medical Centre,"114 Middleton Hall Road, Kings Norton, Birmingham",B30 1DH
M85030,St Heliers Medical Practice,"Northfield Health Centre, 15 St.Heliers Road, Northfield, Birmingham",B31 1QT
M85031,The Harlequin Surgery,"Harlequin Surgery, 160 Shard End Crescent, Birmingham",B34 7BP
M85033,The Manor Practice,"James Preston Health Ctr., 61 Holland Road, Sutton Coldfield, West Midlands",B72 1RL
M85034,Omnia Practice,"Yardley Green Medical Ctr, 73 Yardley Green Road, Birmingham",B9 5PU
M85035,Woodgate Valley Health Centre,"Woodgate Valley Hth. Ctr., 61 Stevens Avenue, Woodgate Valley, Birmingham",B32 3SD
M85037,Kingsfield Medical Centre,"146 Alcester Road South, Kings Heath, Birmingham",B14 6AA
M85041,Bournbrook Varsity Medical Centre,"Bournbrook Varsity Mc, 1A Alton Road, Selly Oak, Birmingham",B29 7DU
M85042,Selly Park Surgery,"2 Reaview Drive, Pershore Road, Selly Park, Birmingham",B29 7NT
M85043,Hawkesley Medical Practice,"Hawkesley Medical Pract., 375 Shannon Road, Kings Norton, Birmingham",B38 9TJ
M85046,Sutton Coldfield Group Practice,"233 Tamworth Road, 233 Tamworth Road, Sutton Coldfield, West Midlands",B75 6DX
M85047,Woodland Road Surgery,"57 Woodland Rd, Northfield, Birmingham",B31 2HZ
M85048,Church Road Surgery,"90 Church Road, Birmingham",B26 3TP
M85051,Firstcare Practice,"Balsall Heath Health Ctr, 43 Edward Road, Birmingham",B12 9LP
M85052,Northfield Health Centre Z,"Northfield Health Centre, 15 St.Heliers Road, Northfield, Birmingham",B31 1QT
M85053,The St.Clements Surgery,"56 Nechells Park Road, Nechells, Birmingham",B7 5PR
M85055,Selly Oak Health Centre,"15 Katie Road, Selly Oak, Birmingham",B29 6JG
M85056,Weoley Park Surgery,"112 Weoley Park Road, Selly Oak, Birmingham",B29 5HA
M85058,Harborne Medical Practice,"4 York Street, Harborne, Birmingham",B17 0HG
M85060,The Oaks Medical Centre,"199 Shady Lane, Great Barr, Birmingham",B44 9ER
M85061,Yardley Green Medical Centre,"Yardley Green Medical Ctr, 77 Yardley Green Road, Bordesley Green, Birmingham",B9 5PU
M85062,Shenley Green Surgery,"22 Shenley Grn, Selly Oak, Birmingham",B29 4HH
M85063,Midlands Medical Partnership,"Eaton Wood Medical Centre, 1128 Tyburn Rd, Erdington, Birmingham",B24 0SY
M85064,Five Ways Health Centre,"Ladywood, Middleway, Birmingham",B16 8HA
M85065,Dr Sn Clay and Partners,"The Poplars Surgery, 17 Holly Lane, Erdington, Birmingham",B24 9JN
M85066,Ward End Medical Centre,"794A Washwood Heath Road, Ward End, Birmingham",B8 2JN
M85069,Laurie Pike Health Centre,"The Laurie Pike Hc, 2 Fentham Road, Aston, Birmingham",B6 6BB
M85070,Reservoir Road Surgery,"192 Reservoir Road, Erdington, Birmingham",B23 6DJ
M85071,Wychall Lane Surgery,"11 Wychall Lane, Kings Norton, Birmingham",B38 8TE
M85074,Wake Green Surgery,"7 Wake Green Road, Moseley, Birmingham",B13 9HD
M85076,Hollymoor Medical Centre,"Manor Pk Grove, Northfield, Birmingham",B31 5ER
M85077,Northwood Medical Centre,"10-12 Middleton Hall Road, Birmingham",B30 1BY
M85078,Oakwood Surgery,"Sparkhill Prim. Care Ctr, 856 Stratford Road, Birmingham",B11 4BW
M85079,Eden Court Medical Practice,"Eden Court Medical Pract., 200 Tangmere Drive, Castle Vale, Birmingham",B35 6EE
M85081,The Dove Medical Practice,"60 Dovedale Rd, Erdington, Birmingham",B23 5DD
M85082,Handsworth Medical Pract.,"4 Trafalgar Road, Handsworth, Birmingham",B21 9NH
M85084,The Wand Medical Centre,"Wand Medical Centre, 15 Frank St., Highgate, Birmingham",B12 0UF
M85085,Modality Ann Jones Family Health Centre,"52 Chesterton Road, Sparkbrook, Birmingham",B12 8HE
M85086,Cofton Medical Centre,"2 Robinsfield Drive, West Heath, Birmingham",B31 4TU
M85087,Dr G Horton's Practice,"452 College Road, Kingstanding, Birmingham",B44 0HL
M85088,Karis Medical Centre,"The Karis Medical Centre, Waterworks Road, Edgbaston, Birmingham",B16 9AL
M85092,Goodrest Croft Surgery,"1 Goodrest Croft, Yardley Wood, Birmingham",B14 4JU
M85094,Yardley Medical Centre,"1222 Coventry Road, Yardley, Birmingham",B25 8BY
M85097,Cranes Park Road Surgery,"25 Cranes Park Road, Sheldon, Birmingham",B26 3SE
M85098,Rotton Park Medical Centre,"264 Rotton Park Road, Edgbaston, Birmingham",B16 0LU
M85105,Victoria Road Surgery,"21 Victoria Road, Acocks Green, Birmingham",B27 7XZ
M85107,Firs Surgery,"87 Kempson Road, Castle Bromwich, Birmingham",B36 8LR
M85108,Small Heath Medical Practice,"Small Heath Med. Practice, 2 Great Wood Road, Small Heath, Birmingham",B10 9QE
M85110,Saltley and Fernbank Medical Practice,"Saltley Ctr.For Hth.Care, Cradock Road, Saltley, Birmingham",B8 1RZ
M85113,Bucklands End Lane Surgery,"Bucklands End Lane Surg, 36 Bucklands End Lane, Castle Bromwich, Birmingham",B34 6BP
M85115,Sutton Road Surgery,"122 Sutton Road, Erdington, Birmingham",B23 5TJ
M85116,Fernley Medical Centre,"560 Stratford Road, Sparkhill, Birmingham",B11 4AN
M85117,Bartley Green Medical Practice,"Bartley Green Med. Pract., 71 Romsley Rd, Bartley Grn, Birmingham",B32 3PR
M85118,Baldwins Lane Surgery,"265 Baldwins Lane, Hall Green, Birmingham, West Midlands",B28 0RF
M85123,Al-Shafa Medical Centre,"5-7 Little Oaks Road, Aston, Birmingham",B6 6JY
M85124,Bellevue Medical Centre,"6 Bellevue, Edgbaston, Birmingham",B5 7LX
M85127,College Road Surgery,"158 College Road, Moseley, Birmingham",B13 9LH
M85128,Dr Walji and Colleagues,"Balsall Heath Health Ctr, 43 Edward Road, Birmingham",B12 9LP
M85134,West Heath Primary C Ctr,"West Heath Primary C.Ctr, 481 Rednal Road, Kings Norton, Birmingham",B38 8AX
M85136,Druids Heath Surgery,"27 Pound Rd, Druids Heath, Birmingham",B14 5SB
M85139,Alpha Medical Practice,"38 Alum Rock Rd, Alum Rock, Birmingham",B8 1JA
M85141,Schoolacre Road Surgery,"Schoolacre Surgery, 2 Schoolacre Rd, Shard End, Birmingham",B34 6RB
M85142,Keynell Covert,"33 Keynell Covert, Kings Norton, Birmingham",B30 3QT
M85143,Jiggins Lane Medical Centre,"Jiggins Lane Medical Ctre, 17 Jiggins Ln, Bartley Grn, Birmingham",B32 3LE
M85145,The Slieve Surgery,"The Surgery, 2 The Slieve, Handsworth Wood, Birmingham",B20 2NR
M85146,The Khattak Memorial Surgery,"58 Benton Road, Sparkbrook, Birmingham",B11 1TX
M85149,Alum Rock Medical Centre,"27-29 Highfield Road, Alum Rock, Birmingham",B8 3QD
M85153,Weather Oak Medical Centre,"35 Warwick Road, Sparkhill, Birmingham",B11 4RA
M85154,Finch Road Primary Care Centre,"Finch Rd Primary Care Ctr, Finch Road, Lozells, Birmingham",B19 1HS
M85155,Dr Bs Sahota's Practice,"Kingstanding Circle Surg., 26 Rough Road, Kingstanding, Birmingham",B44 0UY
M85156,River Brook Medical Centre,"River Brook Medical Ctre, 3 River Brook Drive, Stirchley, Birmingham",B30 2SH
M85158,Dr M Prasad's Practice,"Apollo Surgery, 619 Kings Road, Great Barr, Birmingham",B44 9HW
M85159,BG Health,"108 Bunbury Road, Northfield, Birmingham",B31 2DN
M85164,Newport Medical Practice,"1 Newport Road, Balsall Heath, Birmingham",B12 8QE
M85167,University Medical Practice,"University Medical Pract., University Medical Centre, 5 Pritchatts Road, Edgbaston, Birmingham",B15 2QU
M85170,Gate Medical Centre,"120 Washwood Heath Road, Birmingham, West Midlands",B8 1RE
M85171,Rowlands Road Surgery,"15 Rowlands Road, South Yardley, Birmingham",B26 1AT
M85172,Ridgacre House Surgery,"83 Ridgacre Road, Quinton, Birmingham, West Midlands",B32 2TJ
M85174,The Brook Surgery,"34 Grantham Road, Sparkbrook, Birmingham, West Midlands",B11 1LU
M85175,Dr Mp Clarke's Practice,"The Hawthorns Surgery, 331 Birmingham Road, Sutton Coldfield, West Midlands",B72 1DL
M85176,Kirpal Medical Practice,"Soho Road Health Centre, 247-251 Soho Road, Handsworth, Birmingham",B21 9RY
M85177,Swanswell Medical Centre,"370 Gospel Lane, Birmingham",B27 7AL
M85178,Modality Enki Medical Practice,"Orsborn House, 55 Terrace Road, Birmingham",B19 1BP
M85179,Maypole Health Surgery Y,"Maypole Health Centre, 10 Sladepool Farm Road, Kings Heath, Birmingham",B14 5DJ
M85600,Kings Norton Surgery,"The Kings Norton Surgery, 66 Redditch Road, Kings Norton, Birmingham",B38 8QS
M85624,Perry Park Surgery,"291-293 Walsall Road, Perry Barr, Birmingham",B42 1TY
M85634,Heathfield Family Centre,"131-133 Heathfield Road, Handsworth, Birmingham",B19 1HL
