Code,Name,Address,Postcode
D82027,Heacham Group Practice,"45 Station Road, Heacham, Kings Lynn, Norfolk",PE31 7EX
D82028,Ludham and Stalham Green Surgeries,"The Surgery, Staithe Road, Ludham, Great Yarmouth, Norfolk",NR29 5AB
D82029,Drayton Medical Practice,"Drayton & St Faith's M/P, 8 Manor Farm Cl, Drayton, Norwich, Norfolk",NR8 6EE
D82030,Reepham & Aylsham Medical Practice,"The Surgery, 60 Hungate Street, Aylsham, Norwich",NR11 6AA
D82031,Parish Fields Practice,"The Health Centre, Mount Street, Diss, Norfolk",IP22 4WG
D82032,Brundall Medical Partnership,"The Brundall Medical Ctr, The Dales, The Street, Brundall, Norwich",NR13 5RP
D82034,Attleborough Surgery,"Station Road, Attleborough, Norfolk",NR17 2AS
D82035,Upwell Health Centre,"The Upwell Health Centre, Townley Close, Upwell, Wisbech, Cambridgeshire",PE14 9BT
D82036,Old Mill and Millgates Medical Practice,"Old Mill Surgery, Hardley Road, Poringland, Norwich, Norfolk",NR14 7FA
D82037,Long Stratton Medical Partnership,"Swan Lane Surgery, Long Stratton, Norwich, Norfolk",NR15 2UY
D82038,Wells Health Centre,"The Health Centre, Bolts Close, Wells-Next-The-Sea, Norfolk",NR23 1JP
D82039,Mattishall Surgery,"15 Dereham Rd, Mattishall, East Dereham",NR20 3QA
D82040,Wensum Valley Medical Practice,"West Earlham Health Ctr., West Earlham, Norwich, Norfolk",NR5 8AD
D82041,School Lane Surgery,"The Surgery, School Lane, Thetford, Norfolk",IP24 2AG
D82042,E Harling & Kenninghall Medical Practice,"The Surgery, Market Street, East Harling, Norfolk",NR16 2AD
D82043,Watlington Medical Centre,"Rowan Close, Off Fen Road, Watlington, King's Lynn, Norfolk",PE33 0TU
D82044,Vida Healthcare,"Vida Healthcare/Groadh&Sc, Gayton Road, Kings Lynn, Norfolk",PE30 4DY
D82045,Wymondham Medical Partnership,"Wymondham Medical P/Ship, Wymondham Medical Centre, Postmill Close, Wymondham, Norfolk",NR18 0RF
D82046,Church Hill Surgery,"Station Rd, Pulham Market, Diss, Norfolk",IP21 4TX
D82047,Oak Street Medical Pract.,"Oak Street, Norwich, Norfolk",NR3 3DL
D82048,Thorpewood Medical Group,"Woodside Road, Thorpe St andrew, Norwich",NR7 9QL
D82049,Litcham Health Centre,"Manor Drive, Litcham, Kings Lynn, Norfolk",PE32 2NW
D82050,Theatre Royal Surgery,"Theatre Street, Dereham, Norfolk",NR19 2EN
D82051,Dr Tigchelaar & Partners,"St.James' Medical Pract., County Court Road, King's Lynn, Norfolk",PE30 5SY
D82053,Mundesley Medical Centre,"Munhaven Close, Mundesley On Sea, Norfolk",NR11 8AR
D82054,Fakenham Medical Practice,"Meditrina Hse, Trinity Rd, Fakenham, Norfolk",NR21 8SY
D82056,Elmham Surgery,"The Elmham Surgery, 59 Holt Rd, North Elmham, East Dereham, Norfolk",NR20 5JS
D82057,Campingland Surgery,"The Campingland Surgery, Campingland, Swaffham, Norfolk",PE37 7RD
D82058,Coastal Villages Practice,"Ormesby Village Surgery, Pippin Close, Ormesby, Great Yarmouth, Norfolk",NR29 3RW
D82059,Birchwood Medical Practice,"Birchwood Surgery, Park Lane, North Walsham, Norfolk",NR28 0BQ
D82060,Bacon Road Medical Centre,"16 Bacon Road, Norwich, Norfolk",NR2 3QX
D82062,Coltishall Medical Practice,"Coltishall Medical Pract, St.John's Cl, Rectory Rd, Coltishall, Norwich",NR12 7HA
D82063,Watton Medical Practice,"24 Gregor Shanks Way, Watton, Thetford, Norfolk",IP25 6FA
D82064,Humbleyard Practice,"The Cringleford Surgery, Cantley Lane, Cringleford, Norwich",NR4 6TA
D82065,Manor Farm Medical Centre,"Mangate Street, Swaffham, Norfolk",PE37 7QN
D82066,Paston Surgery,"9-11 Park Lane, North Walsham, Norfolk",NR28 0BQ
D82067,The Park Surgery,"4 Alexandra Road, Great Yarmouth, Norfolk",NR30 2HW
D82068,Howdale Surgery,"The Howdale Surgery, Howdale Road, Downham Market, Norfolk",PE38 9AF
D82069,Newmarket Road Surgery,"7 Newmarket Road, Norwich, Norfolk",NR2 2HL
D82070,Great Massingham Surgery,"Station Road, Great Massingham, Norfolk",PE32 2JQ
D82071,East Norwich Medical Partnership,"St Williams Way, Thorpe St andrew, Norwich, Norfolk",NR7 0AJ
D82072,Burnham Surgery,"The Burnhams Surgery, Church Walk, Burnham Market, Norfolk",PE31 8DH
D82073,The Lionwood Medical Practice,"30A Wellesley Ave North, Norwich, Norfolk",NR1 4NU
D82076,Lawson Road Surgery,"The Health Centre, Lawson Road, Norwich",NR3 4LE
D82078,Heathgate Medical Practice,"Heathgate Surgery, The Street, Poringland, Norwich, Norfolk",NR14 7JT
D82079,Feltwell Surgery,"The Surgery, Old Brandon Road, Feltwell, Thetford, Norfolk",IP26 4AY
D82080,Blofield Surgery,"The Blofield Surgery, Plantation Road, Blofield, Norfolk",NR13 4PL
D82084,Harleston Medical Practice,"Harleston Medical Pract., Bullock Fair Close, Harleston, Norfolk",IP20 9AT
D82085,Hingham Surgery,"Hingham Surgey, Hardingham St, Hingham, Norwich, Norfolk",NR9 4JB
D82087,Prospect Medical Practice,"95 Aylsham Road, Norwich",NR3 2HW
D82088,UEA Medical Centre,"Univ of East Anglia, Earlham Road, Norwich, Norfolk",NR4 7TJ
D82096,Woodcock Rd Surgery,"Woodcock Road Surgery, 29 Woodcock Road, Norwich",NR3 3UA
D82099,Southgates Surgical & Medical Centre,"Southgates Med & Surg Ctr, 41 Goodwins Road, Kings Lynn, Norfolk",PE30 5QX
D82100,Shipdham Surgery,"Chapel Street, Shipdham, Thetford, Norfolk",IP25 7LA
D82104,Acle Medical Partnership,"Bridewell Lane, Acle, Norwich, Norfolk",NR13 3RA
D82105,St Clements Surgery,"St Clement's Surgery, Churchgate Way, Terrington St Clement, Norfolk",PE34 4LZ
D82106,West Pottergate Med Prac,"West Pottergate Med. Prac, The Hlth Ctre, Earlham Rd, Norwich, Norfolk",NR2 4BX
D82600,Fleggburgh Surgery,"The Surgery, Mill Lane, Fleggburgh, Great Yarmouth, Norfolk",NR29 3AW
D82604,Boughton Surgery,"The Surgery, Chapel Road, Boughton, Kings Lynn, Norfolk",PE33 9AG
D82618,The Woottons Surgery,"Spring Cottage, Priory Lane, North Wootton, King's Lynn, Norfolk",PE30 3PT
D82621,Plowright Medical Centre,"1 Jack Boddy Way, Swaffham, Norfolk",PE37 7HJ
D82624,Windmill Surgery,"London Road, Wymondham, Norfolk",NR18 0AF
D82628,Aldborough Surgery,"The Surgery, Chapel Road, Aldborough, Norwich, Norfolk",NR11 7NP
D83001,Constable Country Rural Medical Practice,"Constable Country Mp, Heath Road, East Bergholt, Colchester, Essex",CO7 6RT
D83002,Alexandra & Crestview Surgeries,"Alexandra Road Surgery, Alexandra Road, Lowestoft, Suffolk",NR32 1PL
D83003,Wickhambrook Surgery,"The Surgery, Boyden Close, Nunnery Green, Wickhambrook, Newmarket, Suffolk",CB8 8XU
D83004,Felixstowe Road Medical Practice,"Felixstowe Rd Med Prac, 235 Felixstowe Road, Ipswich, Suffolk",IP3 9BN
D83005,Angel Hill Surgery,"1 Angel Hill, Bury St.Edmunds, Suffolk",IP33 1LU
D83006,Bildeston Health Centre,"The Health Centre, High Street, Bildeston, Ipswich",IP7 7EX
D83007,Ixworth Surgery,"Peddars Close, Ixworth, Bury St. Edmunds, Suffolk",IP31 2HD
D83008,Burlington Road Surgery,"Burlington Primary Care, 14 Burlington Road, Ipswich, Suffolk",IP1 2EU
D83009,Beccles Medical Centre,"St.Mary's Road, Beccles, Suffolk",NR34 9NX
D83010,Longshore Surgeries,"Kessingland Surgery, Field Lane, Kessingland, Lowestoft, Suffolk",NR33 7QA
D83011,Bridge Road Surgery,"The Surgery, 1A Bridge Rd, Oulton Broad, Lowestoft, Suffolk",NR32 3LJ
D83012,Christmas Maltings and Clements Practice,"Clements Surgery, Camps Road, Haverhill, Suffolk",CB9 8LU
D83013,The Guildhall and Barrow Surgery,"Guildhall & Barrow Surg, Lower Baxter Street, Bury St.Edmunds, Suffolk",IP33 1ET
D83014,The Long Melford Practice,"Cordell Rd, Long Melford, Sudbury, Suffolk",CO10 9EP
D83015,Howard House Surgery,"31 Orwell Road, Felixstowe, Suffolk",IP11 7DD
D83016,Victoria Road Surgery,"82 Victoria Road, Oulton Broad, Lowestoft, Suffolk",NR33 9LU
D83017,Needham Market Country Practice,"Needham Market Country Pr, Barking Rd, Needham Market, Ipswich",IP6 8EZ
D83018,Market Cross Surgery,"The Market Cross Surgery, 7 Market Place, Mildenhall, Bury St.Edmunds, Suffolk",IP28 7EG
D83019,Mendlesham Health Centre,"The Health Centre, Chapel Road, Mendlesham, Stowmarket, Suffolk",IP14 5SQ
D83020,The Holbrook and Shotley Practice,"Holbrook Surgery, The Street, Holbrook, Ipswich",IP9 2QS
D83021,Haverhill Family Practice,"Camps Road, Haverhill, Suffolk",CB9 8HF
D83022,Sole Bay H/C,"Teal Close, Reydon, Suffolk",IP18 6GY
D83023,High Street Surgery,"The Surgery, High Street, Lowestoft, Suffolk",NR32 1JE
D83024,Ivry Street Medical Practice,"Ivry St Medical Practice, 5 Ivry Street, Ipswich",IP1 3QW
D83026,Framlingham Surgery,"Pembroke Rd, Framlingham, Woodbridge, Suffolk",IP13 9HA
D83027,Orchard House Surgery,"Fred Archer Way, Newmarket, Suffolk",CB8 8NU
D83028,Leiston Surgery,"The Surgery, Main Street, Leiston, Suffolk",IP16 4ES
D83029,The Rookery Medical Centre,"The Rookery Medical Ctr, The Rookery, Newmarket, Suffolk",CB8 8NW
D83030,Kirkley Mill Health Centre,"Kirkley Mill Surgery, Kirkley Rise, Clifton Rd, Lowestoft, Suffolk",NR33 0HF
D83033,Botesdale Health Centre,"The Health Centre, Back Hills, Botesdale, Diss, Norfolk",IP22 1DW
D83034,Bungay Medical Centre,"28 St Johns Road, Bungay, Suffolk",NR35 1LP
D83035,Cutlers Hill Surgery,"Bungay Road, Halesworth, Suffolk",IP19 8SG
D83036,Church Farm Surgery,"Victoria Road, Aldeburgh, Suffolk",IP15 5BR
D83037,Hadleigh Boxford Group Practice,"Hadleigh Health Centre, Market Place, Hadleigh, Ipswich, Suffolk",IP7 5DN
D83038,Mount Farm Surgery,"Lawson Place, Bury St.Edmunds, Suffolk",IP32 7EW
D83039,The Chesterfield Drive Practice,"Chesterfield Dr Practice, 29 Chesterfield Drive, Ipswich",IP1 6DW
D83040,Victoria Surgery,"Victoria Street, Bury St.Edmunds, Suffolk",IP33 3BB
D83041,Debenham Group Practice,"20 Low Road, Debenham, Suffolk",IP14 6QU
D83043,Eye Health Centre,"The Health Centre, Castleton Way, Eye, Suffolk",IP23 7DD
D83044,Stowhealth,"Violet House, Violet Hill Road, Stowmarket, Suffolk",IP14 1NL
D83045,Lakenheath Surgery,"The Surgery, 135 High Street, Lakenheath, Suffolk",IP27 9EP
D83046,Two Rivers Medical Centre,"30 Woodbridge Road East, Ipswich, Suffolk",IP4 5PB
D83047,Rosedale Surgery,"Ashburnham Way, Carlton Colville, Lowestoft, Suffolk",NR33 8LG
D83048,Grove Medical Centre,"Grove Road, Felixstowe, Suffolk",IP11 9GA
D83049,Little St John Street Surgery,"7 Little St John's Street, Woodbridge, Suffolk",IP12 1EE
D83050,Deben Road Surgery,"2 Deben Road, Ipswich, Suffolk",IP1 5EN
D83051,The Derby Road Practice,"Derby Road Surgery, 52 Derby Road, Ipswich",IP3 8DN
D83053,Saxmundham Health Centre,"Lambsale Mdw, N.Entrance, Saxmundham, Suffolk",IP17 1DY
D83054,The Peninsula Practice,"Mill Hoo, Alderton, Suffolk",IP12 3DA
D83055,Woolpit Health Centre,"Heath Road, Woolpit, Bury St.Edmunds, Suffolk",IP30 9QU
D83056,Hawthorn Drive Surgery,"206 Hawthorn Drive, Ipswich",IP2 0QQ
D83057,Framfield House Surgery,"Framfield Medical Centre, Ipswich Road, Woodbridge, Suffolk",IP12 4FD
D83058,The Norwich Road Surgery,"199 Norwich Road, Ipswich",IP1 4BX
D83059,Barrack Lane Medical Centre,"Barrack Lane Medical Ctr., 1 Barrack Lane, Ipswich",IP1 3NQ
D83060,Hardwicke House Group Practice,"Hardwicke House, Stour Street, Sudbury, Suffolk",CO10 2AY
D83061,Wickham Market Medical Centre,"Wickham Market Med.Ctr., Chapel Lane, Wickham Mrkt, Woodbridge, Suffolk",IP13 0SB
D83062,Forest Surgery,"Bury Road, Brandon, Suffolk",IP27 0BU
D83064,Glemsford Surgery,"The Surgery, Lion Road, Glemsford, Sudbury, Suffolk",CO10 7RF
D83067,Oakfield Surgery,"Vicarage Road, Newmarket, Suffolk",CB8 8HP
D83069,Fressingfield Medical Centre,"Fressingfield Medical Ctr, New Street, Fressingfield, Eye, Suffolk",IP21 5PJ
D83070,Stanton Surgery,"10 The Chase, Stanton, Bury St Edmunds, Suffolk",IP31 2XA
D83073,Dr Solway & Dr Mallick Practice,"Orchard Street Health Ctr, Orchard Street, Ipswich, Suffolk",IP4 2PZ
D83074,Orchard Medical Practice,"Orchard Street, Ipswich, Suffolk",IP4 2PZ
D83075,Siam Surgery,"Sudbury Community Hc, Church Field Road, Sudbury, Suffolk",CO10 2DZ
D83076,Clare Guildhall Surgery,"The Guildhall Surgery, High Street, Clare, Sudbury, Suffolk",CO10 8NY
D83078,The Reynard Surgery,"Turnpike Road, Red Lodge, Bury St Edmunds, Suffolk",IP28 8LB
D83079,Combs Ford Surgery,"Combs Lane, Stowmarket, Suffolk",IP14 2SY
D83080,Martlesham Surgery,"Martlesham Health Surgery, 23 The Square, Martlesham, Suffolk",IP5 3SL
D83081,Haven Health,"Grange Farm Avenue, Felixstowe, Suffolk",IP11 2XD
D83082,Walton Surgery,"301 High Street, Walton, Felixstowe, Suffolk",IP11 9QL
D83084,The Birches Medical Centre,"The Birches Medical Ctr, Twelve Acre Approach, Ipswich, Suffolk",IP5 1JF
D83608,andaman Surgery,"303 Long Road, Lowestoft, Suffolk",NR33 9DF
D83610,Swan Surgery,"The Swan Surgery, Northgate Street, Bury St. Edmunds, Suffolk",IP33 1AE
D83615,The Barham & Claydon Surgery,"The Barham & Claydon Surg, Norwich Road, Barham, Ipswich",IP6 0DJ
E81001,Dr I Saleh's Practice,"The Surgery, 40 Wenlock Street, Luton, Bedfordshire",LU2 0NN
E81002,Greensand Surgery (Ampthill),"Greensand Surgery, The Health Ctr, Oliver St, Ampthill, Bedfordshire",MK45 2SB
E81003,Dr Jl Henderson & Partners,"The Surgery, 29 Bassett Road, Leighton Buzzard, Bedfordshire",LU7 1AR
E81004,Salisbury House Surgery,"Lake Street, Leighton Buzzard, Bedfordshire",LU7 1RS
E81005,Bell House Medical Centre,"163 Dunstable Road, Luton, Bedfordshire",LU1 1BW
E81006,Stopsley Village Practice,"26 Ashcroft Road, Stopsley, Luton, Bedfordshire",LU2 9AU
E81007,Harrold Medical Practice,"Peach's Close, Harrold, Bedford, Bedfordshire",MK43 7DX
E81008,Wheatfield Surgery,"60 Wheatfield Road, Lewsey Farm, Luton, Bedfordshire",LU4 0TR
E81009,West Street Surgery,"89 West Street, Dunstable, Bedfordshire",LU6 1SF
E81010,Dr Whm Matta's Practice,"Leagrave Surgery, 37A Linden Road, Luton, Bedfordshire",LU4 9QZ
E81012,Greensands (Potton),"Greensands Medical Pract., Brook End Surgery, Brook End, Potton, Sandy, Bedfordshire",SG19 2QS
E81013,Castle Medical Group Practice,"27 Castle Street, Luton, Bedfordshire",LU1 3AG
E81014,Priory Gardens Surgery,"The Health Centre, Priory Gdns, Church Street, Dunstable, Bedfordshire",LU6 3SU
E81015,Flitwick Surgery,"Highlands, Flitwick, Bedfordshire",MK45 1DW
E81016,Lister House Surgery,"473-475 Dunstable Road, Luton, Bedfordshire",LU4 8DG
E81018,Dr Jk Marsden's Practice,"Woodland Avenue Practice, 30 Woodland Avenue, Luton, Bedfordshire",LU3 1RW
E81019,London Road Health Centre,"The Health Centre, 84-86 London Road, Bedford, Bedfordshire",MK42 0NT
E81021,Queens Park Health Centre,"23C Carlisle Rd, Queens Pk, Bedford",MK40 4HR
E81022,Larksfield Surgery Medical Partnership,"Larksfield Surgery, Arlesey Road, Stotfold, Hitchin, Hertfordshire",SG5 4HB
E81023,Cater Street Surgery,"The Surgery, 1 Cater Street, Kempston, Bedford",MK42 8DR
E81024,Sharnbrook Surgery,"The Surgery, Templars Way, Sharnbrook, Bedfordshire",MK44 1PZ
E81025,The Oakley Surgery,"Addington Way, Off Oakley Road, Luton, Bedfordshire",LU4 9FJ
E81026,Larkside Practice,"Churchfield Medical Ctr, 322 Crawley Green Road, Luton, Bedfordshire",LU2 9SB
E81027,Houghton Regis Medical Centre,"Houghton Regis Med.Ctr., Peel St, Houghton Regis, Nr.Dunstable, Bedfordshire",LU5 5EZ
E81028,Dr R Khanchandani's Practice,"The Blenheim Medical Ctr, 9 Blenheim Crescent, Luton, Bedfordshire",LU3 1HA
E81029,Putnoe Medical Centre Partnership,"Putnoe Medical Practice, 93 Queens Drive, Putnoe, Bedford, Bedfordshire",MK41 9JE
E81030,Cauldwell Medical Centre,"Bedford Hospital, Kempston Road, Bedford, Bedfordshire",MK42 9DJ
E81031,Great Barford Surgery,"26 Silver Street, Great Barford, Bedfordshire",MK44 3HX
E81032,Lea Vale Medical Practice,"Lea Vale Medical Group, Liverpool Road Health Ctr, 9 Mersey Place, Liverpool Road, Luton",LU1 1HH
E81033,Shefford Health Centre,"Robert Lucas Drive, Hitchin Road, Shefford, Bedfordshire",SG17 5FS
E81034,Toddington Medical Centre,"Luton Road, Toddington, Bedfordshire",LU5 6DE
E81035,Sandy Health Centre,"Northcroft, Sandy, Bedfordshire",SG19 1JQ
E81036,Ivel Medical Centre,"The Ivel Medical Centre, Chestnut Avenue, Biggleswade, Bedfordshire",SG18 0RA
E81037,The De Parys Group,"De Parys Group, 23 De Parys Avenue, Bedford, Bedfordshire",MK40 2TX
E81038,King Street Surgery,"273 Bedford Road, Kempston, Bedford, Bedfordshire",MK42 8QD
E81040,Sundon Medical Centre,"Sundon Park HC, 142/144 Sundon Park Road, Sundon Park, Luton, Bedfordshire",LU3 3AH
E81041,Gardenia Practice,"Gardenia Surgery, 2A Gardenia Avenue, Luton, Bedfordshire",LU3 2NS
E81043,Cranfield Surgery,"137 High St, Cranfield, Bedford, Bedfordshire",MK43 0HZ
E81044,Leighton Road Surgery,"1 Leighton Road, Linslade, Leighton Buzzard, Bedfordshire",LU7 1LB
E81045,Kingsbury Court Surgery,"Church Street, Dunstable, Bedfordshire",LU5 4RS
E81046,Dr Hughes & Partners,"The Surgery, Hexton Road, Barton-Le-Clay, Bedfordshire",MK45 4TA
E81047,Goldington Avenue Surgery,"85 Goldington Avenue, Bedford, Bedfordshire",MK40 3DB
E81048,Bute House Medical Centre,"Grove Road, Luton, Bedfordshire",LU1 1RW
E81049,Priory Medical Centre,"Priory Medical Practice, 48 The Glebe, Clapham, Bedfordshire",MK41 6GA
E81050,Asplands Medical Centre,"Wood Street, Woburn Sands, Milton Keynes, Buckinghamshire",MK17 8QP
E81052,Kirby Road Surgery,"58 Kirby Road, Dunstable, Bedfordshire",LU6 3JH
E81054,Sundon Park Health Centre,"10 Tenth Avenue, Luton, Bedfordshire",LU3 3EP
E81056,St. John's Street Surgery,"St John's Surgery, 16 St John's St, Kempston, Bedford, Bedfordshire",MK42 8EP
E81057,Saffron Health Partnership,"Biggleswade Health Centre, Saffron Road, Biggleswade, Bedfordshire",SG18 8DJ
E81059,Shannon Court Surgery,"Shannon Court, 27B Kings Road, Sandy, Bedfordshire",SG19 1AG
E81060,Linden Road Surgery,"The Surgery, 13 Linden Road, Bedford",MK40 2DQ
E81061,Dr Collins and Carragher,"109 Station Road, Lower Stondon, Henlow, Bedfordshire",SG16 6JJ
E81063,Dr K Prasad's Practice,"Conway Medical Centre, 49 Westbourne Road, Luton, Bedfordshire",LU4 8JD
E81064,Phoenix Primary Care (South) Ltd,"Bramingham Park Med Ctr, Lucas Gdns, Barton Hills, Luton, Bedfordshire",LU3 4BG
E81065,Dr Sa Subramony's Practice,"Medina Medical Centre, 3 Medina Road, Luton, Bedfordshire",LU4 8BD
E81069,Caddington Surgery,"33 Manor Rd, Caddington, Luton, Bedfordshire",LU1 4EE
E81073,The Medici Medical Practice,"The Medici Practice, 3 Windsor Street, Luton, Bedfordshire",LU1 3UA
E81074,Houghton Close Surgery,"1 Houghton Close, Ampthill, Bedfordshire",MK45 2TG
E81076,Dr Dv Shah's Practice,"Pastures Way Surgery, Pastures Way, Lewsey Farm, Luton",LU4 0PF
E81077,Oliver Street Surgery,"The Health Centre, Oliver Street, Ampthill, Bedford, Bedfordshire",MK45 2SB
E81611,Rothsay Surgery,"14 Rothsay Place, Bedford",MK40 3PX
E81612,Drs Mirza Sukhani & Partners,"The Surgery, 30 The Green, Hockwell Ring, Luton, Bedfordshire",LU4 9NN
E81615,Ashburnham Road Surgery,"8 Ashburnham Road, Bedford",MK40 1DS
E81617,Dr Ps Bath's Practice,"49 Ashcroft Road, Stopsley, Luton, Bedfordshire",LU2 9AU
E81631,Malzeard Road Practice,"2A Malzeard Road, Luton",LU3 1BD
E81632,Barton Hills Medical Group,"Whitehorse Vale, Barton Hills, Luton, Bedfordshire",LU3 4AD
E81633,Neville Road Surgery,"5 Neville Road, Luton, Bedfordshire",LU3 2JG
E81635,Eastgate Surgery,"Eastgate House, 28-34 Church Street, Dunstable, Bedfordshire",LU5 4RU
E82001,Rothschild House Surgery,"Chapel Street, Tring, Hertfordshire",HP23 6PU
E82002,Wrafton House Surgery,"9/11 Wellfield Road, Hatfield, Hertfordshire",AL10 0BS
E82004,Hatfield Road Surgery,"2 The Parade, Ellis House, St Albans, Hertfordshire",AL1 3FY
E82005,Stanmore Medical Group,"5 Stanmore Road, Stevenage, Hertfordshire",SG1 3QA
E82006,The Limes Surgery,"8-14 Limes Court, Conduit Lane, Hoddesdon, Hertfordshire",EN11 8EP
E82007,Hanscombe House Surgery,"52A St.andrew Street, Hertford, Hertfordshire",SG14 1JA
E82008,The Nevells Road Surgery,"Nevells Road Surgery, Nevells Road, Letchworth, Hertfordshire",SG6 4TS
E82009,Lincoln House Surgery,"163 London Road, Apsley, Hemel Hempstead, Hertfordshire",HP3 9SQ
E82012,Fairbrook Medical Centre,"4 Fairway Avenue, Borehamwood, Hertfordshire",WD6 1PR
E82013,Bridgewater Surgeries,"Bridgewater House, 7 Printers Avenue, Watford, Hertfordshire",WD18 7QR
E82014,"Lodge,Highfield & Redbourn","The Lodge Surgery, Normandy Road, St. Albans, Hertfordshire",AL3 5NP
E82015,Suthergrey House Medical Centre,"Suthergrey House Med Ctr, 37A St. Johns Road, Watford, Hertfordshire",WD17 1LS
E82017,Garston Medical Centre,"6A North Western Avenue, Watford, Hertfordshire",WD25 9GP
E82018,Lister House Surgery,"Lister House, The Common, Hatfield, Hertfordshire",AL10 0NL
E82019,Bridge Cottage Surgery,"41 High Street, Welwyn, Hertfordshire",AL6 9EF
E82020,Consulting Rooms,"The Consulting Rooms, Oxhey Drive, South Oxhey, Watford, Hertfordshire",WD19 7RU
E82021,Much Hadham Health Centre,"The Health Centre, Ash Meadow, Much Hadham, Hertfordshire",SG10 6DE
E82022,Fernville Surgery,"Fernville, Midland Road, Hemel Hempstead, Hertfordshire",HP2 5BL
E82023,Burvill House Surgery,"52/54 Dellfield Road, Hatfield, Hertfordshire",AL10 8HP
E82024,Wallace House,"5-11 St.andrew Street, Hertford, Hertfordshire",SG14 1HZ
E82027,Parkfield Medical Centre,"The Walk, Potters Bar, Hertfordshire",EN6 1QH
E82028,Berkhamsted Group Practice,"Milton House Surgery, Doctors Commons Road, Berkhamsted, Hertfordshire",HP4 3BY
E82031,Maltings Surgery,"The Maltings Surgery, 8-14 Victoria Street, St Albans, Hertfordshire",AL1 3JB
E82032,Bennetts End Surgery,"Gatecroft, Hemel Hempstead, Hertfordshire",HP3 9LY
E82034,Tudor Surgery,"137/139 Bushey Mill Lane, Watford, Hertfordshire",WD24 7PH
E82035,Knebworth & Marymead Medical Practice,"Knebworth Surgery, Station Road, Knebworth, Hertfordshire",SG3 6AP
E82037,Village Surgery,"The Village Surgery, Amenbury Lane, Harpenden, Hertfordshire",AL5 2BT
E82038,Puckeridge & Standon Surgery,"Puckeridge & Standon Surg, Station Road, Puckeridge, Hertfordshire",SG11 1TF
E82040,Peartree Lane Surgery,"110 Peartree Lane, Welwyn Garden City, Hertfordshire",AL7 3UJ
E82041,The Garden City Practice,"185 Knightsfield, Welwyn Garden City, Hertfordshire",AL8 7QG
E82042,Abbey Road Surgery,"63 Abbey Road, Waltham Cross, Hertfordshire",EN8 7LJ
E82043,Schopwick Surgery,"Everett Court, Romeland, Elstree, Hertfordshire",WD6 3BJ
E82044,The Portmill Surgery,"114 Queen Street, Hitchin, Hertfordshire",SG4 9TH
E82045,Upton Road Surgery,"Ground Floor, Colne House, 21 Upton Road, Watford, Hertfordshire",WD18 0JP
E82046,Vine House Health Centre,"87-89 High Street, Abbots Langley, Hertfordshire",WD5 0AJ
E82048,Theobald Medical Centre,"119-121 Theobald Street, Borehamwood, Hertfordshire",WD6 4PT
E82049,Baldwins Lane Surgery,"266 Baldwins Lane, Croxley Green, Rickmansworth, Herts.",WD3 3LG
E82050,Grove Hill Medical Centre,"Kilbride Court, Grove Hill, Hemel Hempstead, Hertfordshire",HP2 6AD
E82051,Everest House Surgery,"Everest Way, Hemel Hempstead, Hertfordshire",HP2 4HY
E82053,Bancroft Medical Centre,"Bancroft Court, 30-35 Bancroft, Hitchin, Hertfordshire",SG5 1LH
E82055,Midway Surgery,"The Midway Surgery, 93 Watford Road, St.Albans, Hertfordshire",AL2 3JX
E82056,Shephall Health Centre,"29 Shephall Way, Stevenage, Hertfordshire",SG2 9QZ
E82057,Ware Road Surgery,"77 Ware Road, Hertford, Hertfordshire",SG13 7EE
E82058,Potterells Medical Centre,"Potterells Lodge Med.Ctr., Station Road, North Mymms, Hertfordshire",AL9 7SN
E82059,Grange Street Surgery,"2 Grange Street, St. Albans, Hertfordshire",AL3 5NF
E82060,Parkbury House Surgery,"Parkbury House, St.Peters Street, St.Albans, Hertfordshire",AL1 3HD
E82061,Amwell Surgery,"Medical Centre, 19 Amwell Street, Hoddesdon, Hertfordshire",EN11 8FG
E82062,Hall Grove Group Practice,"Hall Grove Practice, 4 Hall Grove, Welwyn Garden City, Hertfordshire",AL7 4PL
E82063,The Maples,"Vancouver Road, Broxbourne, Hertfordshire",EN10 6FD
E82064,Chorleywood Health Centre,"15 Lower Road, Chorleywood, Hertfordshire",WD3 5EA
E82066,Haverfield Surgery,"34 High Street, Kings Langley, Hertfordshire",WD4 9HT
E82067,Church Street Partnership,"30A Church Street, Bishops Stortford, Hertfordshire",CM23 2LY
E82068,Gade Surgery,"99B Uxbridge Road, Rickmansworth, Hertfordshire",WD3 7DJ
E82069,The Elms Surgery,"36 The Avenue, Watford, Hertfordshire",WD17 4NT
E82070,Woodhall Farm Medical Ctr,"Valleygreen, Shenley Rd, Hemel Hempstead, Hertfordshire",HP2 7RJ
E82071,Elms Medical Practice,"The Elms Medical Practice, 5 Stewart Road, Harpenden, Hertfordshire",AL5 4QA
E82072,The Health Centre Practice,"Royston Health Centre, Melbourn Street, Royston, Hertfordshire",SG8 7BS
E82073,Manor View Practice,"Bushey Health Centre, London Road, Bushey, Hertfordshire",WD23 2NN
E82074,South Street Surgery,"83 South Street, Bishops Stortford, Hertfordshire",CM23 3AP
E82075,Regal Chambers Surgery,"50 Bancroft, Hitchin, Hertfordshire",SG5 1LL
E82077,Davenport House Surgery,"Davenport House, Bowers Way, Harpenden, Hertfordshire",AL5 4HX
E82078,Highview Medical Centre,"The Elms, High Street, Potters Bar, Hertfordshire",EN6 5DA
E82079,Cromwell Medical Centre,"11 Cromwell Avenue, Cheshunt, Hertfordshire",EN7 5DL
E82081,Cuffley and Goffs Oak Medical Practice,"Cuffley & Goffs Oak M/Pra, Maynard Place, Cuffley, Hertfordshire",EN6 4JA
E82082,Birchwood Surgery,"232-240 Nevells Road, Letchworth Garden City, Hertfordshire",SG6 4UB
E82083,The Colne Practice,"Colne House Surgery, 99A Uxbridge Road, Rickmansworth, Hertfordshire",WD3 7DJ
E82084,Harvey Group Practice,"13/15 Russell Avenue, St. Albans, Hertfordshire",AL3 5HB
E82085,The Red House Group,"The Red House Surgery, 124 Watling Street, Radlett, Hertfordshire",WD7 7JQ
E82086,King George Surgery,"Health First Med.Group, King George Surgery, 135 High Street, Stevenage, Hertfordshire",SG1 3HT
E82088,Hailey View Surgery,"39 Christian Close, Hoddesdon, Hertfordshire",EN11 9FF
E82089,Chells Surgery,"265 Chells Way, Stevenage, Hertfordshire",SG2 0HN
E82090,Park Lane Surgery,"8 Park Lane, Broxbourne, Hertfordshire",EN10 7NQ
E82091,Parkwood Surgery,"Parkwood Drive Surgery, Warners End, Hemel Hempstead, Hertfordshire",HP1 2LD
E82092,Dolphin House Surgery,"6-7 East Street, Ware, Hertfordshire",SG12 9HJ
E82093,Bedwell Medical Centre,"Sinfield Cl, Bedwell Cres, Stevenage, Hertfordshire",SG1 1LQ
E82094,The Manor Street Surgery,"Manor Street Surgery, Annandale Hse, Manor St, Berkhamsted, Hertfordshire",HP4 2DL
