Code,Name,Address,Postcode
G85031,Dmc Chadwick Road,"60 Chadwick Road, London",SE15 4PU
G85032,Torridon Road Medical Practice,"Torridon Rd Med Practice, 80 Torridon Road, London",SE6 1RB
G85034,Nexus Health Group,"Princess Street GP Pract., 2 Princess Street, Elephant and Castle, London",SE1 6JP
G85035,Morden Hill Surgery,"21 Morden Hill, Lewisham, London",SE13 7NN
G85038,St Johns Medical Centre,"56-60 Loampit Hill, Lewisham, London",SE13 7SX
G85039,Paxton Green Group Practice,"Paxton Green Grp Practice, Paxton Green Hth Centre, 1 Alleyn Park, London",SE21 8AU
G85040,Queens Road Surgery,"136 Meeting House Lane, 12 Queens Road, London",SE15 2UA
G85041,Palace Road Surgery,"3 Palace Road, Streatham Hill, London",SW2 3DY
G85042,St Giles Surgery,"St.Giles Surgery, 40 St.Giles Road, Camberwell, London",SE5 7RF
G85044,Valley Road Surgery,"139 Valley Road, Streatham, London",SW16 2XT
G85045,Hetherington Group Practice,"Hetherington Group Pract, 18 Hetherington Road, London",SW4 7NU
G85046,Lee Road Surgery,"20 Lee Road, Blackheath, East Lewisham, London",SE3 9RT
G85047,Knights Hill Surgery Suite 1,"Suite 1, West Norwood Health & Lc, West Norwood, London",SE27 0DF
G85048,The Brockley Road Surgery,"465-467 Brockley Road, Brockley, London",SE4 2PJ
G85050,Sir John Kirk Close Surgery,"3 Sir John Kirk Close, London",SE5 0BB
G85051,Elm Lodge Surgery,"2 Burbage Road, Dulwich, London",SE24 9HJ
G85052,Old Kent Road Surgery,"182-184 Old Kent Road, London",SE1 5TY
G85053,Hurley and Riverside Practices,"Ebenezer Hs, Kennington Lane, London",SE11 4HJ
G85054,Lambeth Walk Group Practice,"Lambeth Walk Group Prac., 5 Lambeth Walk, London",SE11 6SP
G85055,Hilly Fields Medical Centre,"Hilly Fields Medical Ctr., 172 Adelaide Avenue, Brockley, London",SE4 1JN
G85057,Downham Family Medical Practice,"Downham Family Med Pract, 7-9 Moorside Road, Downham, Kent",BR1 5EP
G85061,Woolstone Medical Centre,"Woolstone Road, London",SE23 2SG
G85073,Vassall Medical Centre,"89 Vassall Road, London",SW9 6NA
G85076,New Cross Centre (Hurley Group),"Waldron Health Centre, Stanley Street, New Cross, London",SE8 4BG
G85081,Sydenham Surgery,"Sydenham Surgery, 2 Sydenham Road, Sydenham, London",SE26 5QW
G85082,Dr Rhk Sinha's Practice,"10 Maddock Way, London",SE17 3NH
G85083,Sandmere Practice,"10-14 Sandmere Road, Clapham, London",SW4 7QJ
G85084,Penrose Surgery,"33 Penrose Street, Borough, London",SE17 3DW
G85085,Grove Medical Centre,"Windlass Place, Off Grove Street, Deptford, London",SE8 3QH
G85086,The South Lambeth Rd Practice,"The South Lambeth Rd Prac, 1 Selway House, 272 South Lambeth Road, London",SW8 1UL
G85087,Silverlock Medical Centre,"At Medics Ltd, 2-3 Warndon Street, London",SE16 3HA
G85089,Honor Oak Group Practice,"Honor Oak Health Centre, 20 Turnham Road, Brockley, London",SE4 2LA
G85091,The Three Zero Six Medical Centre,"3-Zero-6 Medical Centre, 306 Lordship Lane, London",SE22 8LY
G85096,The Vale Surgery,"Streatham Vale, London",SW16 5SE
G85100,Beckett House Practice,"Beckett House, Grantham Road, London",SW9 9DL
G85102,The Vauxhall Surgery,"8 Jonathan Street, Kennington, London",SE11 5NH
G85104,Ico Health Group,"Moorside Clinic, 7-9 Moorside Road, Bromley, Kent",BR1 5EP
G85105,Vesta Road Surgery,"58 Vesta Road, London",SE4 2NH
G85106,Dr Kk Misra's Practice,"Borough Medical Centre, Lornamead House, 1-5 Newington Causeway",SE1 6ED
G85109,Clapham Park Group Practice,"Clapham Park Grp Practice, 72 Clarence Avenue, London",SW4 8JP
G85112,The Hambleden Clinic,"At Medics Ltd, Blanchedowne, Denmark Hill, London",SE5 8HL
G85114,Wells Park Practice,"1 Wells Park Road, Sydenham, London",SE26 6JQ
G85118,Streatham Place Surgery,"28 Streatham Place, London",SW2 4QY
G85119,Sternhall Lane Surgery,"12 Sternhall Lane, Peckham, London",SE15 4NT
G85120,Triangle Group Practice,"2 Morley Road, East Lewisham, London",SE13 6DQ
G85121,Parkview Surgery,"186 Brownhill Road, Catford, London",SE6 1AT
G85123,Binfield Road Surgery,"1 Binfield Road, Kennington, London",SW4 6TB
G85124,Bellingham Green Surgery,"The Bellingham Green Surg, 24 Bellingham Green, Catford, London",SE6 3JB
G85125,Park Medical Centre,"57 Hawkstone Road, London",SE16 2PE
G85127,The Corner Surgery,"99 Coldharbour Lane, East Brixton, London",SE5 9NS
G85129,The Deerbrook Surgery,"216 Norwood Road, London",SE27 9AW
G85130,Mawbey Group Practice,"Mawbey Brough Hlth Ctre, 39 Wilcox Close, London",SW8 2UD
G85132,Melbourne Grove and Hambleden Practice,"Melbourne Grove Med. Prac, Melbourne Grove, East Dulwich, London",SE22 8QN
G85134,The Lister Primary Care Centre,"Lister Primary Care Ctre, 101 Peckham Road, London",SE15 5LJ
G85135,Minet Green Health Practice,"Akerman Health Centre, 60 Patmos Road, London",SW9 6AF
G85136,Waterloo Health Centre,"5 Lower Marsh, Waterloo, London",SE1 7RJ
G85137,Brockwell Park Surgery,"117 Norwood Road, Norwood, London",SE24 9AE
G85138,Albion Street Group Practice,"The Albion Street Hth Ctr, 87 Albion Street, Rotherhithe, London",SE16 7JX
G85623,Bermondsey Spa Medical Centre,"Eyot House, 50 Old Jamaica Road, London",SE16 4BL
G85632,The Villa Street Medical Centre,"The Villa Street Med Ctr, 47 Villa Street, London",SE17 2EL
G85633,Novum Health Partnership,"Rushey Green Grp Practice, PCC, Hawstead Rd, London",SE6 4JH
G85642,Blackfriars Medical Practice,"Blackfriars Medical Pract, 45 Colombo Street, London",SE1 8EE
G85644,The Gardens Surgery,"The Surgery, The Gardens, London",SE22 9QU
G85647,The Exchange Surgery,"2-8 Gracefield Gardens, Streatham, London",SW16 2ST
G85651,The Dulwich Medical Centre,"The Dulwich Medical Ctr, 163-169 Crystal Palace Rd, East Dulwich, London",SE22 9EP
G85662,The Streatham Hill Group Practice,"Streatham Hill Group Prac, 6 Leigham Court Road, London",SW16 2PG
G85673,Springfield Medical Centre,"Springfield Medical Ctr, 110 Union Road, Stockwell, London",SW8 2SH
G85674,Grafton Square Surgery,"8B Grafton Square, Clapham, London",SW4 0DE
G85681,The Lordship Lane Surgery,"417 Lordship Lane, East Dulwich, London",SE22 8JN
G85685,The Nunhead Surgery,"58 Nunhead Grove, Nunhead",SE15 3LY
G85690,Herne Hill Road Medical Practice,"Herne Hill Road Med Pract, 1-3 Herne Hill Road, London",SE24 0AU
G85695,Akerman Medical Practice,"Akerman Health Centre, 60 Patmos Road, London",SW9 6AF
G85696,Vale Medical Centre,"The Vale Medical Centre, 195-197 Perry Vale, Forest Hill, London",SE23 2JF
G85698,Amersham Vale Training Practice,"Suite 5 Waldron Hlth Ctr, Amersham Vale, London",SE14 6LD
G85705,The New Mill Street Surgery,"New Mill Street Surgery, 1 Wolseley Street, London",SE1 2BP
G85706,The Old Dairy Health Centre,"The Old Dairy Health Ctr, 103A Rosendale Road, West Dulwich, London",SE21 8SZ
G85708,Dr Curran & Partners,"The Clapham Manor Hth Ctr, 86 Clapham Manor Street, Clapham, London",SW4 6EB
G85711,Deptford Surgery,"502-504 New Cross Road, Deptford, London",SE14 6TJ
G85715,The Lister Practice,"101 Peckham Road, London",SE15 5LJ
G85716,Oakview Family Practice,"190 Shroffold Road, Downham, Bromley, Kent",BR1 5NJ
G85717,Dr Bk Batra's Practice,"Waldron Health Centre, Stanley Street, New Cross, London",SE8 4BG
G85721,Dr At Bradford's Practice,"301 East Street, Walworth, London",SE17 2SX
G85722,Woodlands Health Centre,"4 Edwin Hall Place, London",SE13 6RN
G85724,Edith Cavell Practice,"At Medics, 41 A-C Streatham Hill, London",SW2 4TP
G85726,St Giles Surgery Dr Patel,"St.Giles Surgery, 40 St.Giles Road, Camberwell, London",SE5 7RF
G85727,Nightingale Surgery,"Lee Hlth Ctr, 2 Handen Rd, London",SE12 8NP
G85736,Deptford Medical Centre,"Deptford Medical Centre, 2 Pearson's Avenue, New Cross, London",SE14 6TG
H81002,Knowle Green Medical,"Staines Health Centre, Knowle Green, Staines, Middlesex",TW18 1XD
H81003,Sunbury Group Practice,"Green Street, Sunbury-On-Thames, Middlesex",TW16 6RH
H81004,Shepperton Medical Practice,"Shepperton Med. Practice, Laleham Road, Shepperton, Middlesex",TW17 8EJ
H81005,Pond Tail Surgery,"The Green, Godstone, Surrey",RH9 8DY
H81006,Austen Road Surgery,"1 Austen Road, Guildford, Surrey",GU1 3NW
H81007,Rowan Tree Practice,"Weybridge Health Centre, 22 Church Street, Weybridge, Surrey",KT13 8DW
H81009,Studholme Medical Centre,"50 Church Road, Ashford, Middlesex",TW15 2TU
H81010,Guildowns Group Practice,"The Oaks, Applegarth Av, Guildford, Surrey",GU2 8LZ
H81011,Nork Clinic,"63 Nork Way, Banstead, Surrey",SM7 1HL
H81013,Bartlett Group Practice,"1 Beech Rd, Frimley Green, Camberley, Surrey",GU16 6QQ
H81015,Chobham & West End Medical Practice,"Chobham&West End Med Prac, 16 Windsor Road, Chobham, Woking, Surrey",GU24 8NA
H81016,Fairfield Medical Centre,"Lower Road, Great Bookham, Leatherhead, Surrey",KT23 4DH
H81017,Ashlea Medical Practice,"Ashlea M/Prac, Gilbert Hse, Gilbert House, 39 Woodfield Lne, Ashtead, Surrey",KT21 2BQ
H81019,Sunny Meed Surgery,"15/17 Heathside Road, Woking, Surrey",GU22 7EY
H81020,Fort House Surgery,"The Fort House Surgery, 32 Hersham Road, Walton-On-Thames, Surrey",KT12 1UX
H81021,The Mill Medical Practice,"Catteshall Mill, Catteshall Road, Godalming, Surrey",GU7 1JW
H81022,Chiddingfold Surgery,"Cedar Ward, Milford Hosp, Tuesley Lane, Godalming, Surrey",GU7 1UF
H81023,Lingfield Surgery,"East Grinstead Road, Lingfield, Surrey",RH7 6ER
H81024,Goldsworth Park Health Centre,"Goldsworth Park Health Ct, Denton Way, Woking, Surrey",GU21 3LQ
H81025,St John's Family Practice,"St Johns Family Practice, Hermitage Road, St Johns, Woking, Surrey",GU21 8TD
H81026,Binscombe Medical Centre,"106 Binscombe, Godalming, Surrey",GU7 3PR
H81027,The Ferns Medical Practice,"Farnham Centre For Health, Hale Road, Farnham, Surrey",GU9 9QS
H81028,Dorking Medical Practice,"New House Surgery, 142A South Street, Dorking, Surrey",RH4 2QR
H81029,Dapdune House Surgery,"Dapdune House, Wharf Road, Woodbridge Road, Guildford, Surrey",GU1 4RP
H81030,Greystone House Surgery,"99 Station Road, Redhill, Surrey",RH1 1EB
H81031,Witley Surgery,"Wheeler Lane, Witley, Nr.Godalming, Surrey",GU8 5QR
H81032,Heathcot Medical Practice,"York House Medical Centre, Heathside Road, Woking, Surrey",GU22 7XL
H81033,Chertsey Health Centre,"Family Health Centre, Chertsey HC, Stepgates, Chertsey, Surrey",KT16 8HZ
H81034,Madeira Medical,"West Byfleet Health Ctr., Madeira Road, West Byfleet, Surrey",KT14 6DH
H81035,Merrow Park Surgery,"Kingfisher Drive, Merrow, Guildford, Surrey",GU4 7EP
H81036,Parishes Bridge Med.Pract,"West Byfleet Health Ctr, Madeira Road, West Byfleet, Surrey",KT14 6DH
H81037,Birchwood Medical Practice,"Birchwood Medical Prac, The Health Ctr, Kings Road, Horley, Surrey",RH6 7DG
H81038,Littleton Surgery,"Buckland House, Esher Park Avenue, Esher, Surrey",KT10 9NY
H81039,Park House Surgery,"6 Park Street, Bagshot, Surrey",GU19 5AQ
H81040,Station Road Surgery,"The Surgery, Station Road, Frimley, Camberley, Surrey",GU16 7HG
H81041,Southview Medical Practice,"Southview Surgery, Southview Court, Guildford Road, Woking, Surrey",GU22 7RR
H81042,Crouch Oak Family Practice,"The Crouch Oak Fam.Prac., 45 Station Rd, Addlestone, Weybridge, Surrey",KT15 2BH
H81043,Wonersh Surgery,"The Street, Wonersh, Guildford, Surrey",GU5 0PE
H81044,Springfield Surgery,"Elstead, Godalming, Surrey",GU8 6EG
H81045,Caterham Valley Med.Pract,"Eothen House, Eothen Close, Caterham, Surrey",CR3 6JU
H81046,Wayside Medical Practice,"Wayside Surgery, Kings Road, Horley, Surrey",RH6 7AD
H81047,Runnymede Medical Practice,"The Health Centre, Bond Street, Englefield Green, Surrey",TW20 0PF
H81048,Holmhurst Medical Centre,"12 Thornton Side, Watercolour, Redhill, Surrey",RH1 2NP
H81050,Wey Family Practice,"West Byfleet Health Ctr., Madeira Road, West Byfleet, Surrey",KT14 6DH
H81051,Derby Medical Centre,"The Derby Medical Centre, 8 The Derby Square, Epsom, Surrey",KT19 8AG
H81052,Cranleigh Medical Practice,"Cranleigh Medical Pract, 18 High Steeet, Cranleigh, Surrey",GU6 8AE
H81053,Villages Medical Ctr,"The Villages Medical Ctr., Send Barns Lane, Send, Woking, Surrey",GU23 7BP
H81055,Hawthorns Surgery,"The Hawthorns, 1 Oxford Road, Redhill, Surrey",RH1 1DT
H81056,Oxted Health Centre,"10 Gresham Road, Oxted, Surrey",RH8 0BQ
H81057,Fordbridge Medical Centre,"4 Fordbridge Road, Ashford, Middlesex",TW15 2SG
H81058,Woodlands Road Medical Centre,"Woodlands Surgery, 5 Woodlands Road, Redhill, Surrey",RH1 6EY
H81060,Townhill Medical Practice,"Guards Avenue, Caterham, Surrey",CR3 5XL
H81061,Hillview Medical Centre,"3 Heathside Road, Woking, Surrey",GU22 7QP
H81062,Haslemere Health Centre,"Church Lane, Haslemere, Surrey",GU27 2BQ
H81064,Fairlands Medical Practice,"The Fairlands Practice, Fairlands Medical Centre, Fairlands Avenue, Worplesdon, Guildford",GU3 3NA
H81065,Hersham Surgery,"The Surgery, Pleasant Place, Hersham, Walton-On-Thames, Surrey",KT12 4HT
H81066,Grove Medical Centre,"The Grove Medical Centre, The Grove, Church Road, Egham, Surrey",TW20 9QJ
H81067,Cobham Health Centre,"Portsmouth Road, Cobham, Surrey",KT11 1HT
H81068,Brockwood Medical Practice,"The Surgery, Tanners Meadow, Brockham, Betchworth, Surrey",RH3 7NJ
H81069,Park Road Group Practice,"Park Road Surgery, 143 Park Road, Camberley, Surrey",GU15 2NN
H81070,Heathcote Medical Centre,"Heathcote, Tadworth, Surrey",KT20 5TH
H81071,Ashley Centre Surgery,"Ashley Square, Epsom, Surrey",KT18 5DD
H81072,Medwyn Surgery,"Medwyn Ctr, Reigate Road, Dorking, Surrey",RH4 1SD
H81073,Church Street Practice,"Weybridge P C Centre, 22 Church Street, Weybridge, Surrey",KT13 8DW
H81074,St Stephens House Surgery,"St.Stephens House, 102 Woodfield Lane, Ashtead, Surrey",KT21 2DP
H81075,Upper Gordon Road Surgery,"Upper Gordon Rd Surgery, 37 Upper Gordon Road, Camberley, Surrey",GU15 2HJ
H81076,Grayshott Surgery,"The Grayshott Surgery, Boundary Road, Grayshott, Hindhead, Surrey",GU26 6TY
H81077,Shere Surgery/Dispensary,"Gomshall Lane, Shere, Guildford, Surrey",GU5 9DR
H81078,Glenlyn Medical Centre,"The Glenlyn Medical Ctr., 115 Molesey Park Road, East Molesey, Surrey",KT8 0JX
H81079,Staines Thameside Medical,"5 Chertsey Lane, Staines, Middlesex",TW18 3JH
H81080,Longcroft Clinic,"The Longcroft Clinic, 5 Woodmansterne Lane, Banstead, Surrey",SM7 3HH
H81081,Tadworth Medical Centre,"1 Troy Clse, Tadworth Farm, Tadworth, Surrey",KT20 5JE
H81082,Camberley Health Centre,"159 Frimley Road, Camberley, Surrey",GU15 2QA
H81083,Moat House Surgery,"The Moat House, Worsted Green, Merstham, Surrey",RH1 3PN
H81084,The Horsley Medical Practice,"The Medical Centre, Kingston Ave, East Horsley, Leatherhead, Surrey",KT24 6QT
H81085,St.Luke's Surgery,"Warren Road, Guildford, Surrey",GU1 3JH
H81086,Thorkhill Surgery,"Thorkhill Gardens, Thames Ditton, Surrey",KT7 0UP
H81087,St David's Family Practice,"Stanwell Hlth & Comm Cntr, Hadrian Way, Stanwell, Middlesex",TW19 7HE
H81088,Downing Street Group Practice,"Downing Street Group Prac, 4 Downing Street, Farnham, Surrey",GU9 7PA
H81089,The Wall House Surgery,"Yorke Road, Reigate, Surrey",RH2 9HG
H81090,Woodbridge Hill Surgery,"1 Deerbarn Road, Guildford, Surrey",GU2 8YB
H81091,Spring Street Surgery,"The Bourne Hall Hth.Ctr., Chessington Road, Ewell, Epsom, Surrey",KT17 1TG
H81094,The Red Practice Walton,"The Health Centre, Rodney Road, Walton-On-Thames, Surrey",KT12 3LB
H81095,The Yellow Practice,"The Health Centre, Rodney Road, Walton-On-Thames, Surrey",KT12 3LB
H81097,River Wey Medical Practice,"Farnham Centre For Health, Hale Road, Farnham, Surrey",GU9 9QS
H81099,Esher Green Surgery,"Esher Green Drive, Esher, Surrey",KT10 8BX
H81101,Whyteleafe Surgery,"19 Station Road, Whyteleafe, Surrey",CR3 0EP
H81103,Eastwick Park Med.Pract.,"Eastwick Park Avenue, Great Bookham, Leatherhead, Surrey",KT23 3ND
H81104,Stanwell Road Surgery,"95 Stanwell Road, Ashford, Middlesex",TW15 3EA
H81107,Oxshott Medical Practice,"Holtwood Road, Oxshott, Surrey",KT22 0QL
H81109,Capelfield Surgery,"Elm Road, Claygate, Esher, Surrey",KT10 0EH
H81110,Holly Tree Surgery,"42 Boundstone Road, Wrecclesham, Farnham, Surrey",GU10 4TG
H81111,Virginia Water Medical Practice,"Packers, Christchurch Road, Virginia Water, Surrey",GU25 4RL
H81113,Leith Hill Practice,"The Leith Hill Practice, The Old Forge Surgery, 168 The Street, Capel, Dorking, Surrey",RH5 5EN
H81116,Elizabeth House Medical Practice,"515 Limpsfield Road, Warlingham, Surrey",CR6 9LF
H81119,Warlingham Green Med Prac,"1 Church Road, Warlingham, Surrey",CR6 9NW
H81122,Hythe Medical Centre Surgery,"The Hythe Medical Centre, Rochester Road, Off Thorpe Road, Staines, Middlesex",TW18 3HN
H81123,Sheerwater Health Centre,"Devonshire Ave, Sheerwater, Woking, Surrey",GU21 5QJ
H81126,Tattenham Health Centre,"Tattenham Crescent, Epsom Downs, Surrey",KT18 5NU
H81128,Vine Medical Centre,"The Vine Medical Centre, 69 Pemberton Road, East Molesey, Surrey",KT8 9LG
H81129,Pirbright Surgery,"The Green, Pirbright, Nr. Woking, Surrey",GU24 0JE
H81130,Lightwater Surgery,"All Saints House, All Saints Road, Lightwater, Surrey",GU18 5SQ
H81131,Dr S Morcos,"The Health Centre, Rodney Road, Walton-On-Thames, Surrey",KT12 3LB
H81132,Guildford Rivers Practice,"Hurst Farm Surgery, Chapel Lane, Milford, Godalming, Surrey",GU8 5HU
H81133,The Integrated Care Partnership,"The Old Cottage Hpl Surg, Alexandra Road, Ewell, Epsom, Surrey",KT17 4BL
H81134,Staines Health Group,"Staines Health Centre, Burges Way, Knowle Green, Staines, Middlesex",TW18 1XD
H81611,Riverbank Surgery,"Westcott Street, Westcott, Dorking, Surrey",RH4 3PA
H81613,Stoneleigh Surgery,"20 Glenwood Road, Stoneleigh, Epsom, Surrey",KT17 2LZ
H81615,Farnham Dene Medical Practice,"Farnham Centre For Health, Hale Road, Farnham, Surrey",GU9 9QS
H81618,Molebridge Practice,"The Molebridge Practice, 3 Cannonside, Fetcham, Leatherhead, Surrey",KT22 9LE
H81632,The Orchard Surgery,"107 Feltham Hill Road, Ashford, Middlesex",TW15 1HH
H81638,Smallfield Surgery,"Wheelers Lane, Smallfield, Nr.Horley, Surrey",RH6 9PT
H81641,The Practice College Road,"4-6 College Road, Maybury, Woking, Surrey",GU22 8BT
H81642,Upper Halliford Medical Centre,"The Surgery, 270 Upper Halliford Road, Shepperton, Middlesex",TW17 8SY
H81643,Maybury Surgery,"The Maybury Surgery, Alpha Road, Woking, Surrey",GU22 8HF
H81644,Fountain Practice,"Bourne Hall Health Centre, Chessington Road, Ewell, Surrey",KT17 1TG
H81647,New Inn Surgery,"202 London Rd, Burpham, Guildford, Surrey",GU4 7JS
H81656,Shadbolt Park House Surg,"Shadbolt Pk, Salisbury Rd, Worcester Park, Surrey",KT4 7BX
H81658,New Ottershaw Surgery,"3 Bousley Rise, Ottershaw, Surrey",KT16 0JX
H81663,Ashley Medical Practice,"1A Crutchfield Lane, Walton On Thames, Surrey",KT12 2QY
H81664,Dr R J Pool,"Greenfield Surgery, 177 High Street, Old Woking, Surrey",GU22 9JH
H81672,Lantern Surgery,"3 Station Approach, Hinchley Wood, Esher, Surrey",KT10 0SP
H82003,Meadows Surgery,"The Meadows Surgery, Temple Grove, Gatehouse Ln, Burgess Hill, West Sussex",RH15 9XN
H82004,Cowfold Surgery,"The Surgery, St.Peter's Close, Cowfold, Horsham, West Sussex",RH13 8DN
H82005,Cuckfield Medical Centre,"Glebe Road, Cuckfield, West Sussex",RH17 5BQ
H82006,The Petworth Surgery,"Petworth Surgery, Grove Street, Petworth, West Sussex",GU28 0LP
H82007,Westcourt Medical Centre,"12 The Street, Rustington, Littlehampton, West Sussex",BN16 3NX
H82008,Ship Street Surgery,"The Ship Street Surgery, Field Cottage, Ship Street, East Grinstead, West Sussex",RH19 4EE
H82009,St.Lawrence Surgery,"The St.Lawrence Surgery, 79 St.Lawrence Avenue, Worthing, West Sussex",BN14 7JL
H82010,Judges Close Surgery,"Judges Close, High Street, East Grinstead, West Sussex",RH19 3AA
H82011,Strand Medical Group,"Strand Medical Group, 1B The Causeway, Goring-By-Sea, West Sussex",BN12 6FA
H82012,Leacroft Medical Practice,"Langley House, Langley Drive, Crawley, West Sussex",RH11 7TF
H82013,Langley House Surgery,"Langley House, 27 West Street, Chichester, West Sussex",PO19 1RW
H82014,Coppice Surgery,"The Coppice Surgery, Herne Lane, Rustington, Littlehampton, West Sussex",BN16 3BE
H82015,Phoenix Medical Group,"4 The Waterfront, Worthing, West Sussex",BN12 4FD
H82016,Bersted Green Surgery,"32 Durlston Drive, Bognor Regis, West Sussex",PO22 9TD
H82017,Park Surgery,"The Park Surgery, Albion Way, Horsham, West Sussex",RH12 1BG
H82020,Bognor Medical Centre,"The Bognor Regis Hlth Ctr, West Street, Bognor Regis, West Sussex",PO21 1UT
H82021,Arundel Surgery,"The Arundel Surgery, Green Lane Close, Arundel, West Sussex",BN18 9HG
H82022,Steyning Health Centre,"The Steyning Health Ctr., Tanyard Lane, Steyning, West Sussex",BN44 3RJ
H82023,Harbour View Healthcare,"The Health Centre, Pond Road, Shoreham-By-Sea, West Sussex",BN43 5US
H82025,Woodlands&Clerklands Partnership,"Woodlands Surgery, Tilgate Way, Tilgate, Crawley, West Sussex",RH10 5BW
H82026,Saxonbrook Medical Centre,"Maidenbower Square, Crawley, West Sussex",RH10 7QH
H82027,Rudgwick Medical Centre,"Station Road, Rudgwick, Horsham, West Sussex",RH12 3HB
H82028,The Courtyard Surgery,"56 London Road, Horsham, West Sussex",RH12 1AT
H82029,The Manor Practice,"Southwick Street, Southwick, West Sussex",BN42 4TA
H82030,Pulborough Medical Group,"Pulborough Primary C/Ctr, Spiro Close, Pulborough, West Sussex",RH20 1FG
H82031,Loxwood Surgery,"Loxwood Medical Practice, Farm Close, Loxwood, West Sussex",RH14 0SU
H82032,Riverbank Medical Centre,"Dodsley Lane, Easebourne, Midhurst, West Sussex",GU29 9AW
H82033,Gossops Green Medical Ctr,"Hurst Close, Gossops Green, Crawley, West Sussex",RH11 8TY
H82034,Lime Tree Surgery,"The Lime Tree Surgery, Lime Tree Avenue, Findon Valley, Worthing, West Sussex",BN14 0DL
H82035,Lindfield Medical Centre,"The Medical Centre, High Street, Lindfield, Haywards Heath, West Sussex",RH16 2HX
H82036,Orchard Surgery,"Lower Tanbridge Way, Horsham, West Sussex",RH12 1PJ
H82037,Selsey Medical Practice,"Selsey Medical Centre, High Street, Selsey, Chichester, West Sussex",PO20 0QG
H82038,Flansham Park Health Centre,"Flansham Park Health Ctr, 109 Flansham Park, Bognor Regis, West Sussex",PO22 6DH
H82039,Park Surgery,"The Park Surgery, St.Flora's Road, Littlehampton, West Sussex",BN17 6BF
H82040,Crawley Down Health Centre,"The Health Centre, Bowers Place, Crawley Down, West Sussex",RH10 4HY
H82041,Victoria Road Surgery,"The Victoria Road Surgery, 50 Victoria Road, Worthing, West Sussex",BN11 1XE
H82042,Cathedral Medical Group,"Cawley Road, Chichester, West Sussex",PO19 1XT
H82043,Grove House Surgery,"80 Pryors Lane, Rose Green, Bognor Regis, West Sussex",PO21 4JB
H82044,Dolphins Practice,"Butlers Green Road, Haywards Heath, West Sussex",RH16 4BN
H82045,Worthing Medical Group,"23 Shelley Road, Worthing, West Sussex",BN11 4BS
H82046,Broadwater Medical Centre,"5-11 Broadwater Boulevard, Worthing, West Sussex",BN14 8JE
H82047,Bridge Medical Centre,"Wassand Cl, Three Bridges, Crawley, West Sussex",RH10 1LL
H82048,Avisford Medical Group,"North End Road, Yapton, Arundel, West Sussex",BN18 0DU
H82049,Parklands Surgery,"The Parklands Surgery, 4 Parklands Road, Chichester, West Sussex",PO19 3DT
H82050,Ifield Medical Practice,"Lady Margaret Road, Ifield, Crawley, West Sussex",RH11 0BF
H82051,Lavant Road Surgery,"8 Lavant Road, Chichester, West Sussex",PO19 5RH
H82052,Pound Hill Medical Group,"1 Crawley Lane, Pound Hill, Crawley, West Sussex",RH10 7DX
H82053,Furnace Green Surgery,"50 The Glade, Furnace Green, Crawley, West Sussex",RH10 6JN
H82055,Billingshurst Surgery,"The Surgery, Roman Way, Billingshurst, West Sussex",RH14 9QZ
H82056,Newtons Practice,"Newtons Surgery, The Health Cntre, Heath Rd, Haywards Heath, West Sussex",RH16 3BB
H82057,Mid Sussex Health Care,"Trinity Road, Hurstpierpoint, West Sussex",BN6 9UQ
H82058,Maywood Health Care Centre,"Maywood Surgery, 225 Hawthorn Road, Bognor Regis, West Sussex",PO21 2UW
H82059,Willow Green Surgery,"Station Rd, East Preston, Littlehampton, West Sussex",BN16 3AH
H82060,Henfield Medical Centre,"Deer Park, Henfield, West Sussex",BN5 9JQ
H82061,Selden Medical Centre,"Selden Road Surgery, 6 Selden Road, Worthing, West Sussex",BN11 2LL
H82063,Moatfield Surgery,"St.Michael's Road, East Grinstead, West Sussex",RH19 3GW
H82064,Southgate Medical Group,"137 Brighton Road, Crawley, West Sussex",RH10 6TE
H82065,Ball Tree Surgery,"Western Rd North, Sompting, Lancing, West Sussex",BN15 9UX
H82066,Fitzalan Medical Group,"Fitzalan Mc, Fitzalan Road, Littlehampton, West Sussex",BN17 5JR
H82067,Tangmere Medical Centre,"Malcolm Road, Tangmere, Chichester, West Sussex",PO20 2HS
H82070,Glebe Surgery,"The Glebe Surgery, Monastery Lane, Storrington, West Sussex",RH20 4LR
H82072,Silverdale Practice,"4 Silverdale Road, Burgess Hill, West Sussex",RH15 0EF
H82076,Cornerways Surgery,"The Cornerways Surgery, 145 George V Avenue, Worthing, West Sussex",BN11 5RZ
H82077,The Croft Surgery,"Barnham Road, Eastergate, Chichester, West Sussex",PO20 3RP
H82078,Southbourne Surgery,"337 Main Road, Emsworth, West Sussex",PO10 8JH
H82083,Northbourne Medical Centre,"193A Upper Shoreham Road, Shoreham By Sea, West Sussex",BN43 6BT
H82084,Brow Medical Centre,"The Brow, Burgess Hill, West Sussex",RH15 9BS
H82087,Barn Surgery,"The Barn Surgery, 22 Ferring St, Ferring, Worthing, West Sussex",BN12 5HJ
H82088,Bewbush Medical Centre,"The Medical Centre, Bewbush Place, Bewbush, Crawley, West Sussex",RH11 8XT
H82089,Riverside Surgery,"48 Worthing Road, Horsham, West Sussex",RH12 1UD
H82091,New Pond Row Surgery,"New Pond Row, 35 South Street, Lancing, West Sussex",BN15 8AN
H82092,Village Surgery,"The Village Surgery, Station Road, Southwater, Horsham, West Sussex",RH13 9HQ
H82095,Witterings Medical Centre,"The Witterings Med Centre, Cakeham Rd, East Wittering, Chichester, West Sussex",PO20 8BH
H82096,The Orchard Surgery,"Penstone Park, Lancing, West Sussex",BN15 9AG
H82098,Coachmans Medical Practice,"Lansbury Road, Broadfield, Crawley, West Sussex",RH11 9JA
H82099,West Meads Surgery,"6 The Precinct, West Meads, Bognor Regis, West Sussex",PO21 5SB
H82100,Northlands Wood Surgery,"7 Walnut Park, Haywards Heath, West Sussex",RH16 3TG
H82615,Ouse Valley Practice,"Dumbledore P/Care Centre, London Road, Handcross, West Sussex",RH17 6HB
